level,id,label,description,value,parent
2,2_58,日本保守党の議席獲得に対する驚きと評価の多様性,このクラスタは、日本保守党が衆院選で議席を獲得したことに対する様々な反応を集めています。驚きや喜びの声が多く見られる一方で、議席獲得に対する懸念や否定的な意見も存在します。また、政党要件を満たすかどうかや、国政政党としての影響力についての関心も高まっています。これらの意見は、保守党の議席獲得が予想外であったことや、その政治的影響についての多様な視点を反映しています。,80,1_4
2,2_41,選挙参加の多様な動機と経験,このクラスタは、選挙に参加することに関する多様な動機や経験を共有する意見で構成されています。選挙に行くことの重要性を認識し、過去の無関心を反省する声や、初めての選挙参加に対する驚きと満足感、選挙に行くきっかけが個々に異なることを示す意見が含まれています。また、選挙後の政治状況を見守る必要性や、選挙の手続きの簡便さに対する意見も見られます。これらの意見は、選挙参加が個人にとってどのような意味を持つのかを多角的に示しています。,256,1_13
2,2_21,選挙結果に対する多様な反応と感情の表出,このクラスタは、選挙結果に対する有権者の多様な反応と感情が表現されています。支持する候補者の当選に対する喜びや安堵、支持しない候補者の当選に対する不満や驚き、または予想外の結果に対する驚きなど、選挙結果に対する個々の感情が多様に表れています。また、選挙に参加すること自体の意義を見出す意見や、候補者の行動や背景に対する評価も含まれています。,124,1_15
2,2_17,自民党の過半数割れと政権交代の可能性に対する関心と不安,このクラスタは、衆院選における自民党の単独過半数割れの可能性に関する意見が中心です。自民党が過半数を割ることに対する驚きや不安、他の政党が受け皿となる可能性、連立政権の行方、そしてそれが日本の政治情勢や経済に与える影響についての関心が示されています。また、民主主義の機能や選挙結果が国民に与える影響についての意見も含まれています。,198,1_3
2,2_44,選挙における裏金問題と投票行動の多様性,このクラスタは、選挙における裏金問題が有権者の投票行動に与える影響についての意見を中心に構成されています。自民党や立憲民主党をはじめとする各政党の裏金問題に対する対応や報道のあり方が議論されており、それが投票行動にどのように反映されているかが示されています。有権者は裏金問題を重視しつつも、政策や他の要因を考慮して多様な投票行動をとっていることが特徴です。また、野党に対する期待や批判、報道の偏りに対する不満も含まれています。,133,1_7
2,2_11,2023年衆院選における選挙結果とその影響に関する多様な意見,このクラスタは、2023年の衆議院選挙に関連する様々な意見を集めたものです。具体的には、特定の候補者の当選や落選に対する驚きや疑問、選挙区ごとの動向、野党の戦略に対する批判、そして選挙結果が地域や国全体に与える影響についての意見が含まれています。特に、岸田氏や河野氏、進次郎氏などの著名な政治家の当選に対する反応が多く見られ、選挙戦略や投票行動に対する評価が議論されています。,177,1_9
2,2_39,選挙結果に対する多様な反応と意見,このクラスタは、選挙結果に関する様々な政治家の当選確実や当選に対する反応を中心に構成されています。特に、特定の政治家の当選に対する驚きや称賛、失望、批判などの多様な感情が表現されています。また、選挙戦略や投票率に関する意見も含まれており、選挙結果がもたらす政治的影響や社会的反響についての関心が示されています。,159,1_10
2,2_52,国民民主党に対する多様な評価と期待の声,このクラスタは、国民民主党に対する様々な意見や評価が集まっています。国民民主党の支持が伸びていることに対する喜びや期待の声が多く見られる一方で、選挙での対応に対する批判や失望の意見も含まれています。また、国民民主党が保守票を獲得していることや、他の野党と比較してまともな政党として評価されている点も注目されています。さらに、国民民主党の政策や活動に対する支持が増えていることに対する驚きや期待の声も上がっており、今後の活躍に期待する意見が多く見られます。,176,1_4
2,2_6,日本の政党間の議席変動とその影響に関する懸念と期待,このクラスタは、日本の衆院選における各政党の議席変動に関する意見を集めています。特に、自民党と公明党の過半数割れの可能性や、立憲民主党の議席増加に対する驚きと懸念が中心です。また、日本維新の会や共産党の議席減少の可能性、旧民主党の議席増加に対する疑問、連立政権の将来に対する不安など、選挙結果が日本の政治に与える影響についての多様な視点が含まれています。これらの意見は、政党間の力関係の変化が日本の政治や経済にどのように影響を及ぼすかについての懸念と期待を反映しています。,109,1_8
2,2_0,選挙参加の重要性と投票率向上への提案,このクラスタは、選挙に参加することの重要性を強調し、投票率を向上させるための様々な提案や意見が集まっています。選挙に行かない人々に対する批判や、選挙に参加しないことが政治に対する意見を述べる資格を失うという考えが多く見られます。また、投票をより便利にするための技術的な提案（スマホやWeb投票の導入）や、投票場所の改善案（コンビニでの投票）も含まれています。さらに、選挙権の行使が未来を担う若者への責任であるという意識や、選挙を通じて政治について学ぶことの重要性も強調されています。,238,1_13
2,2_10,裏金問題と選挙結果に対する有権者の反応と疑問,このクラスタは、裏金問題や収支報告書の不記載が選挙結果に与える影響についての有権者の反応や意見を中心にしています。裏金問題に関与したとされる候補者の落選を望む声や、実際に落選したことに対する喜びの声が多く見られます。一方で、裏金疑惑があるにもかかわらず当選する候補者に対する疑問や、地域の有権者の判断に対する不信感も表明されています。また、裏金問題が選挙に与える影響の大きさや、これまでの選挙との違いを指摘する意見も含まれています。,173,1_15
2,2_22,衆院選における過半数割れの可能性とその影響に関する懸念と期待,このクラスタは、衆議院選挙において与党が過半数を割る可能性に関する意見が集まっています。過半数割れが起こることに対する驚きや懸念、または期待が示されており、選挙結果が与党と野党の力関係にどのように影響するか、連立政権の可能性や国会運営の不安定さについての関心が高まっています。さらに、投票率の低さや選挙結果の不透明さに対する不安の声も含まれています。,135,1_2
2,2_25,自民党の議席減少と立憲民主党の議席増加に対する多様な反応,このクラスタは、自民党の議席減少と立憲民主党の議席増加に対する様々な意見を集めています。自民党の議席減少は予想されていたものの、立憲民主党の議席増加に対しては驚きや疑問、懸念が多く見られます。特に、立憲民主党が自民党を超える可能性や、増税・緊縮財政への懸念、スキャンダル追求に終始するのではないかという不安が挙げられています。また、野党の躍進に対する期待や、政党間の均衡を望む声も含まれています。,162,1_8
2,2_63,立憲民主党の議席増加に対する驚きと疑問の声,このクラスタは、立憲民主党が選挙で大幅に議席を増やすことに対する驚きや疑問の声を中心に構成されています。多くの人々が立憲民主党の議席増加にショックを受けたり、過去の政権運営を懸念したりしています。また、与党の厳しい状況や反ワクチン陰謀論者の影響力への懸念も示されています。さらに、立憲民主党と自民党の議席数の差が大きくないという予想や、野党の議席増加が与党への不満から来ているという意見も含まれています。,165,1_4
2,2_9,れいわ新選組の選挙躍進とその影響に対する多様な反応,このクラスタは、れいわ新選組の選挙における躍進や議席獲得に関する様々な意見や反応を集めています。れいわ新選組が共産党を上回る可能性や、15議席獲得の予測に対する驚きや懸念、支持の増加に対する期待と不安、比例代表制の影響に関する批判など、多様な視点が含まれています。また、れいわ新選組の支持が伸びていることに対する驚きや、他党との比較、政策に対する疑問から支持をやめる意見など、選挙結果がもたらす政治的影響についての関心が示されています。,122,1_5
2,2_50,立憲民主党の支持増加に対する疑問と不安,このクラスタは、立憲民主党の支持が増加していることに対する疑問や驚き、そしてその背景や理由についての不透明さに対する不安が中心です。特に、支持増加の要因が明確でないことや、過去の民主政権の失敗を繰り返さないかという懸念、また自民党の支持低下が影響しているのではないかという見方が含まれています。さらに、立憲民主党が今後どのように国民生活の改善に寄与するのか、具体的な代替案の提示を求める声も見られます。,214,1_8
2,2_24,衆院選における特定候補者の当選・落選に対する多様な反応と情報の信憑性への疑念,このクラスタは、衆議院選挙における特定の候補者、特に萩生田氏、麻生太郎氏、有田氏、西村氏、菅義偉氏、高市早苗氏、前原誠司氏、落合氏、岡本氏、今井雅人氏、中谷防衛大臣などの当選・落選に対する様々な反応を含んでいます。特に、萩生田氏の落選を望む声や麻生太郎氏の当選に対する驚きや否定的な意見が目立ちます。また、選挙結果に関する情報の信憑性に対する疑念や、過去の選挙結果との混同、虚偽情報の可能性についての指摘も含まれています。さらに、麻生氏や菅氏の引退を求める声や、議員に定年を設けるべきだという意見も見られます。,85,1_11
2,2_12,選挙結果に対する多様な反応と期待,このクラスタは、選挙結果に対する様々な反応や期待を示しています。具体的には、当選者に対する祝福や喜びの声、驚きの声、そして特定の候補者に対する期待が含まれています。また、特定の政党や支援団体に関連する候補者の当選に対する反応も見られます。これらの意見は、選挙結果が個人や地域社会に与える影響や、政治的な期待感を反映しています。,123,1_10
2,2_8,消極的選択としての立憲民主党支持とその背景,このクラスタは、選挙における立憲民主党への投票が、必ずしも積極的な支持によるものではなく、他の選択肢が限られている中での消極的な選択であることを示しています。自民党への批判や不満がある一方で、立憲民主党の政策や立場に対する懸念や疑問も多く、特に高齢者層の支持が目立つことが指摘されています。また、他の野党や国民民主党への支持を考慮する意見もあり、選挙区の候補者の多様性や選択肢の不足が問題視されています。,112,1_8
2,2_46,衆院選における選挙区別の注目と不安,このクラスタは、衆院選における各選挙区の当選確定状況や選挙戦の展開に対する関心や不安を示す意見が集まっています。特に、東京24区や埼玉14区などの注目選挙区における接戦や候補者の動向に対する期待や不安、また当選確定が遅れていることへの不満が見られます。さらに、特定の候補者や政党の優勢に対する驚きや、選挙結果に対する不安の声も含まれています。,102,1_9
2,2_26,出口調査に基づく与党の過半数割れと公明党の苦境,このクラスタは、出口調査の結果に基づいて与党（自民党と公明党）が過半数を割る可能性が示唆されていることに関する意見が中心です。特に公明党の石井啓一代表の落選の可能性や、公明党全体の選挙での苦境が強調されています。また、与党が過半数を割った場合の政権運営や連携の行方、石破氏や岸田氏の責任問題、そして選挙結果に対する不正の懸念など、選挙結果がもたらす政治的影響についての意見も含まれています。,75,1_3
2,2_65,選挙に対する不信感と関心の多様性,このクラスタは、選挙に対する不信感や疑念、関心の多様性を示す意見が集まっています。具体的には、選挙の公正性や透明性に対する疑念、投票行動に対する不安、選挙活動や結果に対する失望感、そして選挙に対する関心の薄さや理解の難しさが指摘されています。また、選挙に関連する手続きや情報提供の不足、政治に対する不満や不安も含まれています。これらの意見は、選挙制度や政治に対する信頼の欠如と、選挙に対する多様な関心のあり方を反映しています。,194,1_13
2,2_31,丸川珠代氏の落選に対する多様な反応と政治的影響,このクラスタは、丸川珠代氏の落選に関する様々な意見や反応を中心に構成されています。丸川氏の落選に対する喜びや驚き、批判的な意見が多く見られ、彼女の落選が政治的な風景に与える影響についての考察も含まれています。また、他の政治家の落選や当選に関する意見も交じり、選挙結果がもたらす広範な政治的変化への期待や不安が表現されています。,78,1_11
2,2_49,自公連立の過半数割れと政局の変化に対する多様な視点,このクラスタは、自公連立が過半数を割る可能性に関する多様な意見を集めています。無所属議員や他党との連携による過半数維持の可能性、維新や国民民主党との連立の可能性、野党連合の団結力、立憲民主党の躍進に対する不安、日経平均株価への影響、そして選挙結果に対する期待や懸念など、政治情勢の変化に対する多角的な視点が含まれています。これらの意見は、政局の変化がもたらす影響や、各政党の動向に対する関心を反映しています。,116,1_3
2,2_30,河村たかし氏の当選に対する驚きと評価,このクラスタは、河村たかし氏の選挙での当選に関する意見を中心に構成されています。彼の当選に対する驚きの声や、名古屋での強さを示したことへの評価、さらには彼の功績を称賛する声が含まれています。また、彼の政策や発言に対する評価や批判、そして日本保守党からの出馬に対する驚きも見られます。全体として、河村氏の政治的影響力とその結果に対する多様な反応が集まっています。,193,1_10
2,2_38,選挙結果に対する地域別の反応と影響分析,このクラスタは、各地域における選挙結果に対する有権者の反応や、候補者の当選・落選に関する意見を集めたものです。特に、東京7区や福岡11区、石川3区などの選挙区での結果が注目されており、立憲民主党や自民党の候補者の動向が議論されています。また、選挙区の区割り変更や比例復活の可能性、候補者の個人的な背景（例：インド映画好き）などが選挙結果に与える影響についても言及されています。これらの意見は、選挙結果が地域社会や政治情勢にどのように影響を与えるかを示唆しています。,119,1_9
2,2_14,衆院選における政権交代の可能性とその影響に関する多様な意見,このクラスタは、衆院選における政権交代の可能性に関する多様な意見を集めています。政権交代が仕事や政策に与える影響への不安、選挙結果に対する驚きや期待、政権交代の是非に関する意見、そして選挙後の政治的枠組みや政策の変化に対する関心が含まれています。これらの意見は、選挙結果が国民生活や政治の安定にどのように影響するかについての懸念や期待を反映しています。,189,1_6
2,2_69,選挙特番の多様な楽しみ方と視聴体験,このクラスタは、選挙特番に対する視聴者の多様な反応や楽しみ方に焦点を当てています。視覚的に分かりやすい情報提供や、選挙をエンターテインメントとして楽しむ意見、選挙特番を通じて政治参加の実感を得る意見、さらには選挙特番を見ながらの緊張感や責任感を感じる意見など、選挙特番が視聴者に与える影響や楽しみ方の幅広さが特徴です。また、選挙特番を通じて政治や選挙に対する興味が高まる様子や、選挙を祭りのように楽しむ文化的側面も含まれています。,153,1_12
2,2_66,西村康稔氏の当選に対する多様な反応と評価,このクラスタは、西村康稔氏の当選に関する様々な意見を集めたものです。地元での支持を背景にした当選を喜ぶ声や、彼の政治的強さを評価する意見がある一方で、驚きや不安、疑問の声も上がっています。また、彼の当選が日本の将来に与える影響についての懸念や、対立候補の不在が結果に影響した可能性についての意見も見られます。さらに、彼の政策や過去の行動に対する評価も含まれており、全体として多様な視点からの反応が特徴です。,56,1_11
2,2_54,衆院選における小泉進次郎氏と高市早苗氏の当選に関する多様な意見,このクラスタは、衆議院選挙における小泉進次郎氏と高市早苗氏の当選に関する様々な意見を含んでいます。小泉進次郎氏に関しては、彼の当選に対する驚きや面白さ、今後の当選継続に対する疑問、選挙対策委員長としての役割に関する意見が見られます。一方、高市早苗氏については、彼女の当選が確実視されていること、次期総理大臣としての期待、夫の落選に対する驚き、女性初の首相への期待など、多様な視点からの意見が集まっています。また、両者の当選に対する祝福の声や、選挙結果に対する報道の信憑性に関する意見も含まれています。,70,1_10
2,2_67,選挙結果に対する驚きと多様な反応,このクラスタは、選挙結果に対する驚きや多様な反応を示す意見が集まっています。自民党の候補者が当選したことに対する驚きや不満、逆に落選したことに対する喜び、また野党の動向や選挙区の変化に対する関心が見られます。特に、自民党の強固な支持基盤に対する疑問や、野党の存在感に対する期待と不満が交錯しており、選挙結果が地域や個人の政治的期待にどのように影響を与えているかが浮き彫りになっています。,131,1_7
2,2_62,衆院選後の連立政権形成に関する多様なシナリオとその影響,このクラスタは、衆院選の結果を受けて、各政党がどのように連立を組むかに関する多様なシナリオとその影響についての意見が集まっています。特に、自民党と公明党の連立が過半数を割る可能性がある中で、国民民主党や日本維新の会がキャスティングボードを握る可能性があることが注目されています。また、立憲民主党の連立模索や自公連立の解消、新たな連立の形成に対する期待や懸念も含まれています。これらの意見は、選挙後の政局の不確実性と、各政党の戦略的な動きに対する関心を反映しています。,145,1_3
2,2_4,石破茂氏に対する評価と自民党内の政治的動向,このクラスタは、石破茂氏に関する様々な意見や評価を中心に、自民党内の政治的動向や選挙結果に対する反応を取り上げています。石破氏の与党内での立場や総裁選での選出に対する批判、衆院選での結果に対する責任論、そして石破氏が首相になった場合の自民党内の変化に対する期待や懸念が含まれています。また、石破氏の政策や選挙戦略に対する疑問や批判、他党との比較に基づく意見も見られます。,116,1_1
2,2_1,自民党の選挙結果に対する多角的な評価とその影響,このクラスタは、自民党の衆院選における結果に対する様々な視点からの評価や意見が集まっています。自民党の支持者の棄権や苦戦、敗北の可能性に対する不安や驚き、メディアの影響、反対勢力の成果、そして自民党内での責任追及の動きなど、多様な要因が選挙結果に影響を与えていると考えられています。また、選挙結果が日本の政治や国民生活に与える影響についての懸念や期待も含まれています。,185,1_7
2,2_56,自民党と立憲民主党の支持動向と選挙結果に対する多様な意見,このクラスタは、自民党と立憲民主党の支持動向や選挙結果に対する多様な意見を含んでいます。自民党に対する不満から立憲民主党に票が流れる現象や、立憲民主党の支持が伸びていることに対する疑問、選択肢の限られた状況での不満、そして両党の政策に大きな違いがないと感じる意見が見られます。また、民主党政権時代の再来に対する懸念や、立憲民主党が共産党と連立していることへの不安も示されています。全体として、選挙結果に対する納得感の欠如や、政治的選択肢の限界に対する不満が浮き彫りになっています。,165,1_8
2,2_32,選挙制度と報道に対する不信感と疑問,このクラスタは、選挙制度や報道に対する不信感や疑問を中心にした意見が集まっています。具体的には、開票前や開票直後に当選確実が報じられることへの疑問、出口調査の信頼性、比例代表制のあり方、選挙準備期間の短さ、投票率の低さ、そして政治の混乱が経済に与える影響などが挙げられています。これらの意見は、選挙の透明性や公正性、そして報道の正確性に対する懸念を示しており、国民の政治参加意識や信頼感に影響を与えていることが伺えます。,109,1_13
2,2_27,日本の政党間連携と政界再編の可能性,このクラスタは、日本の主要政党である立憲民主党、国民民主党、日本維新の会、自民党、公明党などの間での連携や連立の可能性、そしてそれに伴う政界再編の動きに関する意見が集まっています。特に、立憲民主党がどの政党と連携するか、国民民主党や日本維新の会がどのような役割を果たすか、また自民党との対抗策としての連携の可能性が議論されています。これらの意見は、今後の日本の政治情勢における政党間の力関係や連携の重要性を示唆しています。,162,1_3
