level,id,label,description,value,parent
1,1_15,選挙結果に対する市民の多様な反応と選挙制度への疑問,衆議院選挙における候補者の当選や落選に対する市民の多様な感情が表出されており、特に選挙速報の迅速さや選挙区の境界に関する混乱、裏金問題に対する不信感が強調されています。市民は選挙結果に対する驚きや喜び、不満を表明しつつ、選挙制度や報道の在り方に対する疑問を投げかけています。また、選挙区の選択肢の限界や候補者の公約履行に対する懸念も示されており、選挙が市民に与える影響や政治への期待と不安が浮き彫りになっています。,691,0
1,1_9,地域別選挙動向と政党支持の変化に対する反応,立憲民主党の躍進や自民党の苦戦など、地域ごとの選挙結果が注目されています。特に、北海道、宮城、新潟、静岡などでの立憲民主党の優勢が強調され、地域ごとの政治的傾向が浮き彫りになっています。また、選挙区ごとの特異な状況や候補者の動向に対する驚きや不安、支持の声が多く見られ、選挙結果が地域社会や政治情勢に与える影響についての多様な意見が交わされています。これにより、地域ごとの歴史的背景や社会的要因が選挙結果にどのように影響を与えているかが示唆されています。,708,0
1,1_14,選挙結果への多様な反応と報道の影響に対する関心の高まり,選挙に対する国民の関心が高まり、結果に対する驚きや期待、不安が交錯しています。特に、選挙速報や報道における裏金問題の影響が注目され、報道の公平性に対する疑問や批判が見られます。また、選挙結果を一種の祭りとして楽しむ声や、特定の議員の落選に対する興味が示され、次回選挙への期待や不安も高まっています。選挙が社会や個人に与える影響が多角的に議論され、国民の意識が選挙プロセスに深く関与していることが示されています。,699,0
1,1_13,選挙参加意識の向上と制度改善への提案,このクラスタは、選挙に対する参加意識の向上と、投票率向上のための具体的な提案が集まっています。若者の投票参加を促進するための方策や、選挙制度の見直し、技術的な改善（ネット投票の導入など）が議論されています。また、選挙に対する不信感や疑念、報道の透明性に対する懸念も示されており、選挙制度の公正性と信頼性を高める必要性が強調されています。選挙参加が個人の意識や生活に与える影響が多角的に表現され、国民の政治参加意識の向上が求められています。,1299,0
1,1_4,選挙における民主系政党の躍進と略称問題による混乱,立憲民主党と国民民主党の略称が同じ『民主党』であることが選挙時に混乱を招き、公平性への懸念が示されています。特に比例代表選挙での票の按分方法に対する疑問が多く、選挙管理の不備が指摘されています。一方で、国民民主党の議席増加や法案提出の可能性に対する期待が高まっており、選挙結果が今後の政策立案に与える影響が注目されています。また、立憲民主党の議席増加に対する驚きや疑問の声も多く、与党からの票流れが背景にあると考えられています。これらの動向は、民主系政党の躍進と選挙制度の課題を浮き彫りにしています。,681,0
1,1_10,選挙結果に対する多様な反応と政治的期待の表出,選挙結果に対する国民の多様な反応が集まっており、特に河野太郎氏や河村たかし氏、高市早苗氏の当選に関する驚きや期待、批判が目立ちます。これらの反応は、特定の政治家の過去の発言や行動、政策に対する評価や批判、さらには今後の政治的影響に対する期待感を反映しています。また、選挙戦略や投票率に関する意見も含まれ、選挙結果がもたらす社会的反響や政治的期待が示されています。,723,0
1,1_7,選挙における自民党の支持動向と裏金問題の影響,このクラスタは、自民党に対する支持と批判が交錯する中で、選挙における裏金問題が有権者の投票行動に与える影響を中心に、多様な意見が集まっています。自民党の強固な支持基盤に対する疑問や、裏金問題が選挙結果に与える影響、若い有権者の投票行動への期待、他党への投票行動、低投票率の影響などが議論されています。これらの意見は、選挙結果に対する国民の複雑な感情と政治への関心を反映し、選挙後の政治的変化や国民生活への影響についての懸念や期待を示しています。,603,0
1,1_12,選挙特番とスポーツ中継の同時放送に対する視聴者の多様な視点と楽しみ方,選挙特番と日本シリーズの同時放送に対する視聴者の反応は多岐にわたります。選挙速報と野球中継の同時進行により、視聴者は情報の混在や放送の質に対する不満を抱く一方で、両方のイベントを同時に楽しむことができるという肯定的な意見も見られます。視聴者は、選挙特番を通じて政治参加の意識を高めたり、エンターテインメントとして楽しんだりする様子が伺えます。また、放送の優先順位やサブチャンネルの活用、手話や字幕の導入に関する議論も活発で、視聴者のメディア消費行動や選挙報道の在り方に関する重要な示唆を提供しています。,807,0
1,1_11,選挙結果に対する多様な反応と情報の信憑性への懸念,選挙結果に関する情報の信憑性に対する疑念が広がる中、特定候補者の当選・落選に対する多様な反応が見られます。特に、丸川珠代氏や下村博文氏の落選に対する驚きや喜び、麻生太郎氏や西村康稔氏の当選に対する評価や不安が交錯しています。また、選挙結果の正確性を求める声や、比例復活の可能性、与党の議席数に関する議論が展開され、選挙結果が政治全体に与える影響についての関心が高まっています。これらの意見は、選挙結果の影響や情報の正確性に対する関心を反映しています。,692,0
1,1_3,衆院選における与党過半数割れの可能性と政局変動への関心,自民党と公明党の連立が過半数を割る可能性に対する懸念と期待が交錯しています。選挙結果が確定していない中で、国民民主党や日本維新の会の動向が今後の政策に大きな影響を与える可能性が指摘されています。与党の過半数割れが現実となった場合の政権運営や連立の行方、さらには日本の政治情勢や経済に与える影響についての多様な意見が集まっています。特に、立憲民主党や他の野党の躍進、連立政権の形成に関するシナリオが注目されており、選挙後の政局の不確実性と各政党の戦略的な動きに対する関心が高まっています。,973,0
1,1_1,石破政権の短命化と自民党内外の政治的動向に対する懸念,石破茂氏の総理大臣としての地位が不安定であることに対する憶測や批判が高まっており、彼のリーダーシップや組織運営に対する疑問が政権の安定性に影響を与えています。自民党内での石破氏の立場や選挙結果に対する責任論が浮上し、彼の退陣や政権交代の可能性が議論されています。また、石破氏の政策や選挙戦略に対する批判、他党との比較に基づく意見が見られ、彼の政治的影響力の持続性に対する不安が示されています。,354,0
1,1_8,日本の政党間の議席変動とその影響に対する多様な視点,自民党の議席減少と立憲民主党の議席増加に関する意見が多く集まっており、これらの変動が日本の政治に与える影響についての懸念と期待が示されています。特に、自民党の支持低下に伴う立憲民主党への票の流れや、立憲民主党の躍進に対する驚きと疑問が多く見られます。また、選挙結果が政権交代や政策の変化にどのように影響するかについての不安や期待が表明されています。これらの意見は、政党間の力関係の変化が日本の政治や経済に及ぼす影響についての多様な視点を反映しています。,1084,0
1,1_2,衆院選における与党過半数割れの可能性とその政治的影響への関心,衆議院選挙において与党が過半数を割る可能性が高まる中、選挙結果が与党と野党の力関係にどのように影響するかについての関心が集まっています。与党の過半数割れがもたらす政治的変革の兆しや、野党の台頭、連立政権の可能性、国会運営の不安定さ、そして経済への影響についての議論が活発です。また、投票率の低さや選挙結果の不透明さに対する不安、報道の信頼性に対する疑問、与野党の拮抗状況に対する多様な視点が示されています。これらの要素が、今後の日本の政治動向にどのように影響を与えるかについての期待と懸念が交錯しています。,399,0
1,1_5,れいわ新選組の選挙躍進とその影響に対する多様な反応,このクラスタは、れいわ新選組の選挙における躍進や議席獲得に関する様々な意見や反応を集めています。れいわ新選組が共産党を上回る可能性や、15議席獲得の予測に対する驚きや懸念、支持の増加に対する期待と不安、比例代表制の影響に関する批判など、多様な視点が含まれています。また、れいわ新選組の支持が伸びていることに対する驚きや、他党との比較、政策に対する疑問から支持をやめる意見など、選挙結果がもたらす政治的影響についての関心が示されています。,122,0
1,1_6,衆院選における政権交代の可能性と地域別支持動向の影響分析,衆院選における政権交代の可能性が注目される中、選挙結果が国民生活や政治の安定に与える影響についての懸念や期待が広がっています。特に、日本維新の会の地域別支持動向が選挙結果に大きく影響を与えており、大阪での強い支持と他地域での評価の違いが浮き彫りになっています。これにより、政権交代が起こるかどうか、またその結果としての政策変化や政治的枠組みの再編成がどのように進むのかが注目されています。選挙後の政権運営の安定性や、地域ごとの支持動向が今後の政治情勢に与える影響について、多様な意見が交わされています。,299,0
2,2_42,衆議院選挙における候補者の当落に対する多様な感情と意見,このクラスタは、衆議院選挙における候補者の当選や落選に対する有権者の多様な感情や意見を反映しています。特定の候補者の当選や落選に対する期待や不満、選挙結果の予測に対する驚きや皮肉、選挙区の地盤や知名度の影響、候補者の行動や態度に対する批判、そして選挙後の公約履行に対する懸念など、選挙に関連する様々な視点が含まれています。これらの意見は、選挙結果が有権者に与える影響や、政治に対する期待と不安を示しています。,200,1_15
2,2_16,立憲民主党の躍進と地域別選挙動向,このクラスタは、立憲民主党が多くの地域で支持を集め、選挙での躍進が報じられていることを中心に、地域ごとの選挙動向が議論されています。特に北海道、宮城、新潟、静岡などでの立憲民主党の優勢が強調されており、これに対する驚きや支持、または疑問の声が上がっています。また、他の政党との競争や選挙区ごとの特異な状況も取り上げられ、選挙結果に対する多様な意見が見られます。,208,1_9
2,2_61,選挙に対する多様な関心と反応,このクラスタは、選挙に関連する様々な意見や反応を集めたものです。選挙の重要性や結果に対する関心、選挙プロセスの楽しみ方、メディアの影響力、選挙に対する個人の感情的な反応など、多岐にわたる視点が含まれています。選挙が社会や個人に与える影響や、選挙に対する人々の興味の高まりが強調されています。,201,1_14
2,2_20,低投票率に対する懸念とその影響に関する多角的な意見,このクラスタは、衆院選の低投票率に対する不満や懸念を中心に、投票率の低さがもたらす政治的影響や国民の意識に関する多様な意見が集まっています。特に、若年層の投票率向上の必要性、選挙の意義に対する疑問、政治への関心の低さ、選挙権の行使の重要性、そして低投票率がもたらす将来的なリスクについての議論が含まれています。また、SNSの影響や選挙結果の重要性に対する意見も見られ、全体として国民の政治参加の意識向上が求められていることが浮き彫りになっています。,246,1_13
2,2_5,2024年衆議院選挙に対する多様な関心と期待,このクラスタは、2024年の衆議院選挙に対する国民の多様な関心や期待、不安が集まっています。選挙結果に対する驚きや満足感、与党の今後に対する不安、女性候補の活躍、投票率の期待、デマの広がりに対する懸念など、選挙に関連する様々な視点が含まれています。また、選挙の重要性を認識し、積極的に情報を追いかける姿勢が見られ、選挙が国民にとって大きな関心事であることが示されています。,221,1_14
2,2_28,選挙結果に対する多様な反応と次回選挙への期待,このクラスタは、選挙結果に対する驚きや期待、不安といった多様な反応が集まっていることが特徴です。特に、八王子や岡山の選挙結果に注目が集まっており、出口調査や開票番組に対する関心も高まっています。また、次回の選挙に向けた期待や不安、後継者問題への懸念も見られ、選挙結果が国民の意見をどのように反映するかに対する関心が示されています。,190,1_14
2,2_53,立憲民主党と国民民主党の略称重複による選挙混乱と公平性への懸念,このクラスタは、立憲民主党と国民民主党の略称が共に『民主党』であることに起因する選挙時の混乱や不明確さに対する懸念を表しています。特に、比例代表選挙において、投票用紙に『民主党』と書かれた場合にどちらの党に票がカウントされるのか、またその按分方法の公平性に疑問を持つ声が多く上がっています。さらに、略称の重複が有権者の混乱を招き、選挙管理の不備や有権者軽視といった批判も含まれています。,28,1_4
2,2_35,選挙区境界と当確速報に対する市民の反応と混乱,このクラスタは、選挙区の境界付近に住む市民が選挙期間中に経験する混乱や、選挙結果の速報に対する驚きや関心を示す意見が集まっています。特に、選挙区の境界によるポスター掲示の混乱、予想外の当確速報、選挙区ごとの結果に対する驚きや関心、そして選挙結果の早期確定に対する疑問や驚きが中心となっています。これらの意見は、選挙区の境界や速報の仕組みに対する市民の理解や期待が反映されています。,194,1_15
2,2_51,選挙結果に対する多様な反応と疑問,このクラスタは、選挙結果に対する様々な反応や意見が集まっています。特に、河野太郎氏の当選に関する驚きや疑問の声が多く見られ、彼の過去の発言や行動に対する批判も含まれています。また、他の候補者の当選や落選に対する驚きや期待、批判の声もあり、選挙結果に対する国民の多様な視点が反映されています。,178,1_10
2,2_29,自民党に対する支持と批判の多様な視点,このクラスタは、自民党に対する支持と批判が交錯する選挙に関する多様な意見を集めています。自民党の過去の強さや現在の支持状況に対する疑問、裏金問題や解散のタイミングに関する批判、若い有権者の投票行動への期待、他党への投票行動、低投票率の影響、そして自民党のリーダーシップや政策に対する評価など、幅広い視点が含まれています。これらの意見は、選挙結果に対する国民の複雑な感情と政治への関心を反映しています。,154,1_7
2,2_13,TBSの選挙特番と日本シリーズ同時放送に対する視聴者の多様な反応,このクラスタは、TBSが選挙特番と日本シリーズを同時に放送することに対する視聴者の多様な意見を集めています。選挙と野球の情報が混在することによる放送の質の低下や、視聴者の混乱を指摘する声がある一方で、両方のイベントを同時に楽しむことができるという肯定的な意見も見られます。また、サブチャンネルの活用を求める声や、放送の優先順位に関する議論、さらには特定の出演者に対する応援の声など、視聴者の関心が多岐にわたっていることが特徴です。,95,1_12
2,2_3,国民民主党の議席増加と石丸氏の影響に関する多様な視点,このクラスタは、国民民主党が衆院選で議席を増やしたことに対する様々な意見や期待を中心に構成されています。石丸氏の登場が評価に与えた影響や、議席増加による法案提出の可能性、さらには減税実現への期待など、党の戦略や選挙結果に対する多角的な視点が含まれています。また、石丸氏の起用が若年層の票を狙った戦略であるとの見解や、議席増加が党の認知度向上に寄与するという意見も見られます。,122,1_4
2,2_57,地域別に見る政党支持の多様性と選挙結果への反応,このクラスタは、日本各地における政党支持の多様性と、それに伴う選挙結果への反応を示しています。群馬や山形、熊本、福岡などでは自民党が強い支持を受けている一方で、沖縄や新潟、福島では自民党が苦戦している様子が見られます。また、立憲民主党や社民党の当選に対する驚きや納得の声もあり、地域ごとの政治的傾向や選挙結果に対する多様な意見が反映されています。特に、福島では2011年の原発事故を背景にした立憲民主党への支持が見られ、地域の歴史的背景が選挙結果に影響を与えていることが示唆されています。,102,1_9
2,2_2,選挙結果に関する情報の信憑性と確認の必要性,このクラスタは、選挙結果に関する情報の信憑性に対する疑念や確認の必要性に焦点を当てています。多くの情報が前回の選挙結果や虚偽の可能性があるとされ、現時点での公式な結果が確定していないことから、情報の正確性を求める声が多く見られます。また、特定の候補者の当選に関する期待や驚きの声も含まれています。,148,1_11
2,2_48,自民・公明連立の過半数割れに関する不安と期待,このクラスタは、自民党と公明党の連立が過半数を割る可能性についての意見が集まっています。過半数割れの可能性に対する期待や不安、他党との連携の必要性、選挙結果の不透明さ、そしてそれに伴う政治的な影響についての議論が中心です。特に、過半数割れが現実となった場合の政治的再編や、他党の躍進の可能性についての意見が多く見られます。,211,1_3
2,2_60,石破政権の短命化と退陣に関する憶測と批判,このクラスタは、石破茂氏が総理大臣としての地位を維持することが困難であるという意見や、彼の退陣を予想・望む声、さらには石破政権が短命に終わる可能性についての憶測が中心です。特に、解散総選挙の結果や石破氏の政治的判断に対する批判が多く見られ、彼の辞任や政権交代の可能性についての関心が高まっています。また、石破氏のリーダーシップや組織の問題が政権の安定性に影響を与えているとの見解も含まれています。,127,1_1
2,2_55,自民党の議席減少と政局への影響に関する多様な意見,このクラスタは、自民党の議席減少に関する様々な意見を集めたものです。自民党の議席減少が予想される中で、その理由や影響についての疑問や驚き、さらには政権維持や政権交代の可能性に対する期待や懸念が表明されています。また、投票率の低さや他党の動向が政局に与える影響についても注目されています。これらの意見は、政治の現状に対する多様な視点を反映しており、特に自民党の戦略や支持基盤の変化に対する関心が高まっていることが特徴です。,137,1_8
2,2_7,選挙速報における裏金問題の影響と報道の反応,このクラスタは、選挙速報において裏金問題がどのように報道され、視聴者や有権者にどのような影響を与えているかに関する意見が集まっています。裏金に関する情報が選挙結果や報道の公平性に影響を与えていること、またその報道の仕方に対する驚きや批判、さらにはユーモラスな反応が見られる点が特徴です。特に、裏金問題が選挙結果に与える影響や、報道における表現の仕方に対する意見が多く見られます。,87,1_14
2,2_45,選挙結果に対する反応と情報の信憑性に関する議論,このクラスタは、衆院選における二階氏の息子と世耕氏の選挙結果に対する反応を中心に構成されています。二階氏の息子の落選や比例復活に対する否定的な意見が多く見られる一方で、世耕氏の当選に対する肯定的な意見や驚きの声が上がっています。また、選挙結果の情報の信憑性に対する疑問や、特定の候補者の当選が難しいとする意見も含まれています。これらの意見は、選挙結果の影響や情報の正確性に対する関心を反映しています。,134,1_11
2,2_40,選挙速報に対する多様な視点と楽しみ方,このクラスタは、選挙速報に対する人々の多様な反応や楽しみ方を示しています。選挙速報を楽しみにしている人々や、特定の候補者やアナウンサーに対する驚きの声、選挙特番を楽しむ様子、選挙報道のあり方に対する意見など、選挙速報がもたらす様々な感情や意見が集まっています。また、選挙速報を見ながらリラックスしたり、他の興味を一時的に置いておくといった、選挙速報を生活の一部として楽しむ様子も含まれています。,270,1_12
2,2_23,選挙特番に対する多様な視聴者の反応と意見,このクラスタは、選挙特番に対する視聴者の多様な反応や意見を集めたものです。選挙特番の放送時間や内容に対する不満、特定の番組やチャンネルの選好、放送の公平性やエンタメ化への批判、YouTubeやTVerなどの代替視聴手段の利用、特番の影響で通常番組の放送時間が変更されることへの驚きや不満など、選挙特番に関する様々な視点が含まれています。これらの意見は、選挙報道の在り方や視聴者のメディア消費行動に関する重要な示唆を提供しています。,201,1_12
2,2_19,選挙参加の多様な体験と意識の変化,このクラスタは、選挙に参加した人々の多様な体験や意識の変化に関する意見が集まっています。初めての選挙参加や家族と一緒に投票する経験、選挙に行くことの重要性を感じる声、選挙に行けなかったことへの後悔、そして選挙後の日常生活の楽しみなど、選挙が個々の生活や意識に与える影響が多角的に表現されています。また、選挙に参加することを称賛する声や、次回の選挙参加を呼びかける意見も含まれ、選挙への参加意識の向上が見られます。,146,1_13
