level,id,label,description,value,parent
1,1_15,選挙結果に対する国民の多様な反応と政治不信の表出,選挙結果に対する国民の反応は多岐にわたり、当選や落選の速報に対する驚きや期待、特定の候補者に対する支持や不満が表れています。特に、裏金問題や候補者の倫理観に対する批判が強く、政治不信が広がっていることが伺えます。選挙区ごとの結果に対する関心や、選挙戦略の評価、選挙管理の公正性に対する疑念が示されており、国民の政治に対する期待と不安が交錯しています。これらの意見は、選挙が国民に与える影響や、政治の透明性と信頼性に対する要求を反映しています。,691,0
1,1_9,地域ごとの選挙結果と支持動向の多様性に対する驚きと分析,日本各地での選挙結果に対する有権者の反応や分析が多様であることが示されています。特定の地域での政党の強さや予想外の結果に対する驚きが強調され、例えば、立憲民主党が宮城や新潟、北海道で強い支持を得ている一方で、自民党が熊本や山形で優勢であることが注目されています。また、選挙区ごとの接戦や当選確定の遅れに対する関心が高く、特に埼玉14区や千葉5区などでの状況が話題となっています。これらの意見は、地域ごとの政治的動向が国全体の政治情勢に与える影響を示し、選挙結果が有権者に与える多様な感情や期待、失望を反映しています。,708,0
1,1_14,選挙報道と政治参加意識の高まりによる社会的関心の拡大,選挙に対する多様な関心が高まり、選挙報道や結果に対する期待、不安、驚きが交錯しています。Vtuberによる投票促進や女性候補者の増加、選挙速報の演出などが注目され、国民の政治参加意識が高まっています。また、裏金問題の報道が選挙の透明性に対する疑問を呼び起こし、選挙結果がもたらす社会的変化への期待と不安が入り混じっています。これらの要素が、選挙を通じた社会的関心の拡大を促進しています。,699,0
1,1_13,選挙参加促進と制度改善への具体的提案と懸念,選挙における低投票率の影響や、選挙制度に対する不信感が広がる中、投票率向上のための具体的な提案や、選挙参加の重要性を訴える声が集まっています。具体的には、投票場所の利便性向上や若者の政治参加を促進するためのインセンティブの提案、選挙制度の透明性と公正性を求める意見が見られます。また、選挙に参加しないことが将来の社会問題に対する発言権を失うことにつながるという懸念や、選挙結果が日本の未来に与える影響についての不安も示されています。これらの意見は、選挙を通じて社会を変えるための行動の重要性を強調し、制度的な改善を求める声として集約されています。,1299,0
1,1_4,選挙における政党の議席動向と略称問題への対応,選挙において、立憲民主党や国民民主党、参政党、日本保守党などの議席動向が注目されています。特に、国民民主党の議席増加に対する期待や、立憲民主党の予想外の議席増加に対する驚きが見られます。また、政党略称の混乱が選挙の公平性に影響を与える懸念が示されており、選挙管理の改善が求められています。これらの動向は、今後の政策決定や政党間の力関係に大きな影響を与えると考えられています。,681,0
1,1_10,選挙結果に対する多様な感情と評価の表出,選挙結果に対する有権者の多様な感情や評価が集まっており、特定の候補者の当選に対する驚きや喜び、疑問、不安が表れています。河村たかし氏や河野太郎氏、高市早苗氏、小泉進次郎氏などの当選に関する意見が多く、彼らの政治姿勢や過去の行動に対する評価が分かれています。また、選挙結果が特定の派閥や政治家にとっての勝利と見なされる意見や、組織票の影響、政策に対する評価も含まれ、選挙結果がもたらす影響についての関心が示されています。これらの意見は、選挙戦の動向や候補者に対する評価が多様に示されており、選挙結果が社会に与える影響についての多角的な視点を提供しています。,723,0
1,1_7,選挙結果に対する多様な反応と政治的課題の浮き彫り,自民党を中心とした選挙結果に対する国民の多様な反応が示されており、特に裏金問題や報道の公平性が選挙行動に影響を与えていることが浮き彫りになっています。自民党の当選や落選に対する驚きや称賛、批判が交錯し、地域ごとの支持基盤の違いや投票率の低さが選挙結果に影響を与えているとの見解が見られます。また、他党の候補者の当選や落選に対する反応も含まれ、国民の政治に対する期待や不安、そして現状に対する不満が反映されています。これらの意見は、政治の透明性や報道の公平性、そして政党の戦略に対する国民の関心と期待を示しています。,603,0
1,1_12,選挙報道とエンターテインメントの同時進行における視聴者の多様な反応とメディアの役割,選挙特番と日本シリーズの同時放送に対する視聴者の反応は多岐にわたります。視聴者は、選挙報道の重要性とエンターテインメントのバランスに対する期待や不満を示しています。選挙速報を通じて政治への関心を高める一方で、野球中継との同時進行に困惑する声もあります。メディアの報道姿勢や選挙特番の内容に対する評価、選挙報道の信頼性や公平性に対する意見が交錯し、視聴者は情報の多角的な取得を求めています。また、選挙特番が視聴者の日常生活や他の娯楽活動に与える影響についても多様な意見が寄せられています。,807,0
1,1_11,選挙結果に対する不確定情報と政治的変化への期待,選挙結果に関する不確定情報や虚偽の可能性が指摘される中、特定の政治家の当選や落選に対する多様な反応が見られます。和歌山2区での世耕氏の当選や二階氏の息子の落選、丸川珠代氏や下村博文氏の落選に対する意見は、地域政治や世襲政治に対する批判的な視点を反映しています。また、選挙結果が政治的勢力図に与える影響や、政治家に対する評価が議論されており、政治の変革を求める声が背景にあることが示唆されています。これらの意見は、選挙制度や政治家に対する不信感を反映し、社会的影響や政治的変化への関心を示しています。,692,0
1,1_3,日本の政治情勢における連立政権の変動と新勢力の台頭,自民党と公明党の連立政権が次の衆院選で過半数を維持できるかどうかに対する不安が広がる中、選挙結果がもたらす政治的・経済的影響が注目されています。特に、立憲民主党や国民民主党、日本維新の会の躍進が予測され、これらの政党が新たな連立の可能性を模索する動きが見られます。公明党の影響力低下や、他党との連携の行方が今後の政局を左右する要因となり、選挙結果が株価や為替に与える影響も懸念されています。また、メディアによる選挙予測の違いが不確実性を増し、報道の信頼性が問われる中、国民の政治参加意識の変化が求められています。,973,0
1,1_1,石破政権の不安定なリーダーシップと選挙結果への影響,石破政権はその不安定なリーダーシップと短命化の可能性が指摘されており、選挙結果に対する責任問題が浮上しています。石破氏のリーダーシップに対する批判や期待が交錯し、彼の政治的影響力の低下が懸念されています。自民党の過半数割れの可能性や、石破氏の辞任、他党との連携の可能性が議論される中、政権の将来に対する不安が広がっています。また、石破氏の選挙戦略や解散総選挙の決断に対する批判があり、彼の退陣や政権交代の可能性が注目されています。,354,0
1,1_8,選挙結果に対する多様な視点と政党間の支持動向の変化,衆院選における自民党の議席減少と立憲民主党の躍進に対する多様な意見が集まっています。自民党の議席減少に対する驚きや喜び、立憲民主党の支持増加に対する疑問や不安が交錯し、選挙結果に対する国民の複雑な感情が浮き彫りになっています。特に、投票率の低さや他党への票の流れ、過去の政党対応への懸念が指摘され、選挙区の選択肢の限られた状況が不満を生んでいます。また、立憲民主党の躍進が自民党の失策や風向きによるものとする見解や、民主党政権時代の再来を懸念する声もあり、今後の政党間の動向に注目が集まっています。,1084,0
1,1_2,衆院選における与野党の勢力均衡と政権運営への影響,衆議院選挙において与党が過半数を割る可能性が高まり、連立政権の形成やねじれ国会の発生が注目されています。与党が過半数を割ることで、野党との協力が必要となり、政権運営の不透明感が増す一方で、政治の均衡が保たれることへの期待も示されています。選挙結果が経済や外交政策に与える影響についての懸念が広がる中、与野党の勢力が拮抗することで、より建設的な政治運営が求められています。選挙結果が不透明であることから、国民の関心が高まり、政治情勢の変動が予想される中での意見が集まっています。,399,0
1,1_5,れいわ新選組の選挙躍進と支持動向に対する驚きと期待,このクラスタは、れいわ新選組が選挙で議席を増やす可能性に対する驚きや期待、そして他党との比較における支持動向の変化に関する意見が集まっています。特に、れいわ新選組が共産党を上回る可能性や、予想以上の議席獲得に対する驚きの声が多く、また、支持者の間では議席数の増加を期待する声が強調されています。一方で、政策に対する疑問や出口調査の信憑性に対する懸念も見られます。,122,0
1,1_6,選挙結果による政権交代の可能性と地域的支持の影響,衆院選を通じて政権交代の可能性に対する期待と不安が交錯する中、大阪を中心に維新の党が強い支持を得ている現象が注目されています。政権交代がもたらす変化への期待と、過去の経験からくる不安が混在し、特定の政党や候補者に対する地域的な支持や不満が選挙結果に影響を与えています。特に、大阪での維新の党の勢力拡大が他地域や国政に与える影響について、多様な視点からの意見が示されています。選挙結果が今後の政権運営や政策推進にどのように影響するかについての関心が高まっています。,299,0
2,2_42,選挙結果に対する多様な反応と期待,このクラスタは、選挙結果に対する有権者の多様な反応や期待を反映しています。具体的には、当選や落選の確実予報に対する驚きや不満、特定の候補者の当選や落選に対する喜びや懸念、選挙区での候補者選びの難しさ、当選者の公約履行への期待、宗教法人との関わりを持つ候補者への不信感、選挙戦略や結果に対する評価などが含まれています。これらの意見は、選挙が有権者に与える影響や、政治に対する期待と不安を示しています。,200,1_15
2,2_16,立憲民主党の地域別支持動向と選挙結果の驚き,このクラスタは、立憲民主党が特定の地域で強い支持を得ていることや、選挙結果に対する驚きの声に焦点を当てています。特に宮城、新潟、北海道などでの立憲民主党の優勢が注目されており、これらの地域での支持の強さが強調されています。また、岐阜や愛媛での予想外の結果に対する驚きや、福井での立憲民主党候補の健闘が話題となっています。これらの意見は、立憲民主党の地域別の支持動向と、それに対する有権者の反応を示しています。,208,1_9
2,2_61,選挙に対する多様な関心と期待の高まり,このクラスタは、選挙に対する多様な関心や期待が高まっていることを示しています。選挙が祭りのように盛り上がり、異なる視点を持つ人々の意見に触れることでエコーチェンバーを脱する経験や、Vtuberの呼びかけによる投票促進、選挙結果への興味、政治に対する新たな関心の芽生えなど、選挙を通じて社会的な関心が広がっている様子が描かれています。また、選挙結果や特定の議員の落選に対する興味深さ、選挙管理内閣への感謝、選挙を通じた社会の変化への期待など、多様な視点から選挙が捉えられています。,201,1_14
2,2_20,低投票率に対する懸念とその影響に関する多角的視点,このクラスタは、選挙における低投票率に対する驚きや懸念の声を中心に、投票率の低さが日本の未来に与える影響についての多様な意見が集まっています。具体的には、投票率の低さが政策決定における市民の影響力を弱めることへの懸念、感情的な投票行動や政策への無関心がもたらすリスク、そして投票しないことが将来の社会問題に対する発言権を失うことにつながるという批判的な意見が含まれています。また、投票率の低下が社会的な関心の低さや制度的な問題に起因しているという指摘も見られます。,246,1_13
2,2_5,2024年衆院選に対する多様な反応と関心の高まり,このクラスタは、2024年の衆議院選挙に対する多様な反応や意見を集めたものです。選挙結果に対する驚きや衝撃、女性候補者の増加、出口調査による当選者の予測、選択の難しさ、歴史的な選挙になる可能性、投票率への関心、選挙後の議員活動への注視など、選挙に対する関心が非常に高まっていることが示されています。また、選挙速報や結果に対する期待や興奮、選挙に対する熱意が感じられる意見も多く、国民の政治参加意識の高まりがうかがえます。,221,1_14
2,2_28,選挙に対する期待と不安、興味の交錯,このクラスタは、選挙に関連する様々な感情や意見が交錯していることを示しています。選挙結果に対する期待や不安、驚き、意外性を感じる声が多く、選挙のプロセスや結果に対する関心が高まっていることが伺えます。また、メディアの報道に対する期待や疑問、個人情報の取り扱いに対する懸念など、選挙に関連する多様な視点が含まれています。選挙がもたらす社会的変化や影響に対する期待と不安が入り混じり、選挙が国民にとって重要な関心事であることが強調されています。,190,1_14
2,2_53,選挙における政党略称の混乱と公平性への懸念,このクラスタは、立憲民主党と国民民主党の略称が同じ『民主党』であることに起因する選挙時の混乱や不明確さに対する疑問や懸念を表しています。有権者が投票用紙に略称を書く際にどちらの政党に票がカウントされるのか不明確であること、またその結果として票が按分されることへの公平性の疑問が中心です。さらに、公式名称を略さずに使用するべきだという意見や、選挙管理の方法に対する批判も含まれています。,28,1_4
2,2_35,選挙結果に対する驚きと期待の声,このクラスタは、選挙結果の速報に対する人々の驚きや期待、そしてそれに伴う感情の多様性を反映しています。特に、当確が早く出たことや、予想外の結果に対する驚き、接戦区の結果に対する期待感、そして自分の選挙区の結果に対する不安や関心が中心となっています。選挙結果の早さや予測の難しさが、選挙に対する人々の関心を高めていることが伺えます。,194,1_15
2,2_51,選挙結果に対する多様な反応と意見,このクラスタは、選挙結果に対する様々な反応や意見が集まっています。特に河野太郎氏の当選に関する意見が多く、支持や驚き、疑問、不安など多様な感情が表れています。また、他の候補者の当選や落選に対する驚きや喜び、批判の声も含まれています。選挙における組織票の問題や、特定の政策に対する評価も見られ、選挙結果がもたらす影響についての関心が示されています。,178,1_10
2,2_29,自民党に対する多様な意見と選挙結果への反応,このクラスタは、自民党に対する多様な意見と選挙結果に対する反応を中心に構成されています。自民党の当確を喜ぶ声や、支持に対する疑問、批判的な意見が混在しており、特に低い投票率や他党の弱体化が自民党の選挙結果に影響を与えているという見解が見られます。また、与党に対する批判が経済や安全保障よりも重要視されているという意見や、他の政党に政権を任せることを考える声も含まれています。全体として、自民党の支持と批判が交錯し、選挙結果に対する多様な視点が示されています。,154,1_7
2,2_13,選挙と野球中継の同時放送に対する視聴者の多様な反応,このクラスタは、選挙と野球中継が同時に放送されることに対する視聴者の多様な意見を集めています。TBSをはじめとするテレビ局が選挙特番と日本シリーズを同時に放送することに対して、驚きや不満、感謝の声が上がっています。視聴者は、選挙と野球のどちらを優先するかで意見が分かれており、選挙報道の質や放送のタイミングに対する批判も見られます。また、選挙の日にテレビ番組が選挙関連に偏ることへの不満や、視聴の難しさを指摘する声もあります。これらの意見は、視聴者が情報を多角的に得ようとする姿勢や、放送局の選択に対する期待と不満を反映しています。,95,1_12
2,2_3,国民民主党の議席増加への期待とその影響,このクラスタは、国民民主党の議席増加に対する期待とその影響についての意見が中心です。特に、国民民主党が21議席以上を獲得する可能性や、単独で法案を提出できる議席数を確保することへの期待が強調されています。また、国民民主党の議席増加が他の政党や連立に与える影響、さらには政策立案への期待も含まれています。石丸氏の影響や選挙戦略に関する意見も見られ、国民民主党の支持動向に対する関心が高まっていることが示されています。,122,1_4
2,2_57,地域別に異なる自民党と野党の支持動向とその影響,このクラスタは、日本各地における自民党と野党の支持動向に関する意見を集めたものです。特に、地域ごとに異なる支持の強さや選挙結果に対する反応が特徴的です。例えば、熊本や山形、奈良中南部、和歌山、広島、富山では自民党が強い支持を得ている一方で、愛知、沖縄、宮城、岩手、新潟、福島では野党が優勢または自民党が苦戦している状況が見られます。また、群馬や山形では自民党の強い支持に対する不安や不満の声も上がっており、地域ごとの政治的な動向が国全体の政治情勢に与える影響が注目されています。,102,1_9
2,2_2,選挙結果に関する不確定情報と虚偽の可能性,このクラスタは、衆院選に関する当選情報が多く報じられているが、それらの情報が現時点での公式な結果ではなく、前回の選挙結果の誤解や虚偽の情報である可能性があることを指摘しています。情報の信憑性に対する疑念や、現時点での結果が確定していないことを強調する意見が中心です。,148,1_11
2,2_48,自民・公明連立政権の過半数維持に対する不安と影響,このクラスタは、自民党と公明党の連立政権が次の衆院選で過半数を維持できるかどうかに対する不安や疑問が中心となっています。特に、裏金問題や公認取り消しといったスキャンダルが選挙結果に影響を与える可能性が指摘されており、与党の議席減少が予測される中で、立憲民主党や国民民主党の躍進が注目されています。また、過半数を割ることで憲法改正が難しくなるといった政策面での影響や、議会での議論が活発化する可能性についても言及されています。,211,1_3
2,2_60,石破政権の不安定性と短命化に関する懸念と憶測,このクラスタは、石破政権の不安定な状況とその短命化に関する懸念や憶測を中心に構成されています。石破氏の毅然とした態度や組織の問題、責任問題が浮上していることが指摘され、政権の短命化や退陣の可能性が議論されています。また、石破氏の政治的影響力の低下や、次期総裁の動向、連立の拡大など、今後の政治状況に対する不安や期待が示されています。,127,1_1
2,2_55,自民党の議席減少と選挙結果に対する多様な反応,このクラスタは、衆院選における自民党の議席減少に関する様々な意見や反応を集めたものです。自民党の議席減少に対する驚きや喜び、またその原因や影響についての考察が含まれています。特に、投票率の低さや他党への票の流れ、過去の政党対応への懸念、そして自民党の今後の動向に対する期待や不安が表れています。また、選挙速報や報道に対する疑念や、野党の対応への期待も見られます。,137,1_8
2,2_7,選挙報道における裏金問題の演出とその影響,このクラスタは、選挙速報や特番において裏金問題がどのように報道され、視聴者にどのような影響を与えているかに関する意見が集まっています。特に、裏金疑惑のある議員に対する特別なマークや演出が注目されており、それが面白いと感じる一方で、報道の公平性や選挙の透明性に対する疑問の声も上がっています。また、裏金問題が選挙結果に与える影響や、国民の監視の目が強まっていることに対する評価も含まれています。,87,1_14
2,2_45,和歌山2区選挙における世耕氏の当選と二階氏の息子の落選に関する意見,このクラスタは、和歌山2区の選挙において世耕氏の当選が確実視されていることと、二階氏の息子が落選する可能性が高いことに関する意見が中心です。世耕氏の当選を祝福する声や、二階氏の息子の落選に対する喜びの声が多く見られます。また、世耕氏の自民党復党の可能性や、二階氏の息子の比例復活の可能性についても注目されています。これらの意見は、選挙結果が地域政治に与える影響や、世襲政治に対する批判的な視点を反映しています。,134,1_11
2,2_40,選挙速報の視聴体験とその多様な感情,このクラスタは、選挙速報を視聴することに対する多様な感情や行動に焦点を当てています。選挙速報を初めて真剣に観る人や、習慣として楽しむ人、心地よさや緊張感を感じる人など、視聴者の様々な反応が含まれています。また、選挙報道の内容や形式に対する期待や不満、選挙速報を待ち望む声、そして選挙に対する真摯な期待感など、選挙速報が引き起こす多様な感情が表現されています。,270,1_12
