level,id,label,description,value,parent
2,2_23,選挙特番に対する多様な視聴者の反応と意見,このクラスタは、選挙関連のテレビ報道に対する視聴者の多様な意見や反応を集めたものです。選挙特番の放送時間や内容に対する驚きや疑問、特定の番組や局の独自性や面白さに対する評価、選挙報道の公平性や信頼性に関する懸念、選挙特番の放送タイミングに関する意見、さらには選挙特番と他の番組との比較に基づく視聴選択の迷いなど、視聴者が選挙報道に対して抱く様々な感情や考えが反映されています。,201,1_12
2,2_19,選挙参加の意識と行動に関する多様な声,このクラスタは、選挙に関する様々な意識や行動に関する意見が集まっています。選挙に行きそびれたことを後悔する声や、選挙に参加したことを誇りに思う意見、家族や子供と共に選挙に参加することの重要性を説く声など、選挙に対する個々の経験や感情が多様に表現されています。また、選挙を通じて政治への関心を高めたり、家族や友人との交流を深めたりする様子も見られます。,146,1_13
2,2_58,日本保守党の議席獲得に対する多様な反応とその影響,このクラスタは、日本保守党が議席を獲得したことに対する様々な意見や反応を中心に構成されています。議席獲得に対する驚きや喜び、否定的な意見、さらなる議席獲得への期待、そして他党との関係性や影響についての議論が含まれています。また、政党助成金の交付条件やメディアでの取り上げ方に対する不満、陰謀論の支持に対する懸念など、選挙結果がもたらす政治的影響についての多角的な視点が示されています。,80,1_4
2,2_41,選挙体験と投票行動に関する多様な視点,このクラスタは、選挙に関する個人の体験や意見を多角的に捉えたものです。初めての投票体験や手続きのスムーズさ、投票所の変更に対する驚き、期日前投票の利用、投票率向上のための提案、選挙結果に対する感想、政治への関心の変化、選挙活動の印象、投票後の行動など、選挙に関連する様々な視点が含まれています。これらの意見は、選挙に対する個々の関心や行動、そしてそれに伴う感情の多様性を示しています。,256,1_13
2,2_21,選挙結果に対する多様な反応と意見の集約,このクラスタは、選挙結果に対する様々な反応や意見が集まっており、支持する候補者の当選を喜ぶ声や、予想外の結果に対する驚き、特定の候補者の落選に対する意見などが含まれています。また、選挙戦略や候補者の背景に対する批判や分析も見られ、選挙結果がもたらす政治的影響や個人の感情的反応が多様に表現されています。,124,1_15
2,2_17,自民党の過半数割れとその影響に関する多様な視点,このクラスタは、自民党が衆議院選挙で過半数を割る可能性に関する意見を中心に、政治的な影響や経済的な影響、他党の躍進、連立政権の可能性など、多様な視点が含まれています。自民党の議席減少に対する喜びや懸念、野党の動向、株価や為替への影響、連立の行方など、選挙結果がもたらす多面的な影響についての意見が集まっています。,198,1_3
2,2_44,政治における裏金問題と報道の公平性に関する意見の多様性,このクラスタは、政治における裏金問題に対する有権者の多様な意見と、それに関連する報道の公平性についての議論を中心にしています。自民党をはじめとする与党や野党の裏金問題に対する批判や疑念、報道の偏向性に対する不満、そしてそれが選挙行動に与える影響についての意見が集まっています。また、特定の政党や候補者への投票理由や、家族内での投票先の違いなど、個々の投票行動に関する具体的な事例も含まれています。,133,1_7
2,2_11,衆院選における当選確実報道と有権者の反応,このクラスタは、衆議院選挙における各候補者の当選確実報道に対する有権者の反応や意見を中心にまとめられています。特に、岸田氏や河野太郎氏、小泉進次郎氏などの著名な政治家の当選に対する驚きや疑問、選挙区ごとの特定候補者に対する支持や批判、選挙結果に対する不満や諦めの声が多く見られます。また、選挙区ごとの特定の候補者に対する支持や批判、選挙結果に対する不満や諦めの声が多く見られます。これらの意見は、選挙結果に対する有権者の多様な感情や期待、失望を反映しています。,177,1_9
2,2_39,選挙結果に対する多様な反応と評価,このクラスタは、選挙結果に対する様々な反応や評価を含んでいます。特定の候補者の当選に対する驚きや喜び、疑問、批判など、多様な意見が集まっています。特に、小沢一郎氏や高市氏、菅氏などの当選に関する意見が多く、彼らの過去の行動や政策に対する評価が分かれていることが特徴です。また、選挙結果が特定の派閥や政治家にとっての勝利と見なされる意見も含まれています。,159,1_10
2,2_52,国民民主党の支持拡大とその影響に関する多様な意見,このクラスタは、国民民主党の支持が拡大していることに関する様々な意見を集めています。支持の増加に対する驚きや称賛、選挙での躍進を評価する声が多く見られる一方で、政策の信頼性や立候補者の不足といった課題も指摘されています。また、他党との比較や競争、若年層からの批判、与党入りの可能性に対する懸念など、国民民主党の今後の動向に対する関心が高まっていることが特徴です。,176,1_4
2,2_6,与党過半数割れと立憲民主党の躍進に対する懐疑と不安,このクラスタは、与党である自民党が過半数を割る可能性が高まっている状況に対する意見を中心に、立憲民主党の議席増加に対する懐疑的な見方や不安が表明されている点が特徴です。多くの意見が、与党の議席減少を予想しつつも、立憲民主党の躍進を望まない、あるいはその理由に疑問を持つ声を含んでいます。また、他の野党の議席動向や連立政権の行方についても注目が集まっており、選挙結果に対する不安や懸念が広がっています。,109,1_8
2,2_0,選挙の重要性と投票率向上への多角的アプローチ,このクラスタは、選挙の重要性を強調し、投票率を向上させるための様々な意見や提案が集まっています。選挙が個人や社会に与える影響を訴える意見や、投票に行かない人々への批判、投票率向上のための具体的な提案（ネット投票や投票場所の改善）などが含まれています。また、選挙権の歴史的背景や権利の重みを再認識する意見もあり、選挙を通じて未来を変えるための行動の重要性が強調されています。,238,1_13
2,2_10,裏金問題に対する国民の厳しい審判と政治不信,このクラスタは、選挙における裏金問題に対する国民の厳しい視線と、それに伴う政治不信を反映しています。裏金疑惑のある候補者や議員に対する不信感や批判が多く見られ、彼らの落選を望む声が強調されています。また、裏金問題が選挙結果に与える影響や、疑惑のある候補者が当選することへの疑問、そしてそれに対する地域や国民の反応が議論されています。これらの意見は、政治家の倫理観や選挙の公正性に対する国民の期待と不安を示しています。,173,1_15
2,2_22,衆院選における過半数割れの可能性とその影響,このクラスタは、衆議院選挙において与党が過半数を割る可能性に関する意見を中心に構成されています。過半数割れが選挙結果に与える影響や、連立政権の形成、ねじれ国会の発生といった政治的な動向に対する関心が高まっていることが特徴です。また、選挙結果が不透明であることから、緊張感や期待感が高まっている様子も見受けられます。,135,1_2
2,2_25,自民党の議席減少と立憲民主党の議席増加に対する疑問と驚き,このクラスタは、衆議院選挙における自民党の議席減少が予想通りである一方、立憲民主党の議席増加に対して疑問や驚きを感じる意見が中心です。特に、立憲民主党の議席増加に対する不信感や、他の政党の動向に対する関心が示されています。また、民主主義の限界や、特定の政党に対する不満が背景にあることが伺えます。,162,1_8
2,2_63,立憲民主党の議席増加に対する驚きと疑問,このクラスタは、立憲民主党が予想以上に議席を増やしたことに対する驚きや疑問の声が中心です。特に、立憲民主党の議席増加が日本の政治や将来に与える影響についての不安や懸念が多く見られます。また、選挙協力の効果や他党の躍進に対する評価、比例票の動向に関する意見も含まれています。,165,1_4
2,2_9,れいわ新選組の選挙躍進と支持動向に対する驚きと期待,このクラスタは、れいわ新選組が選挙で議席を増やす可能性に対する驚きや期待、そして他党との比較における支持動向の変化に関する意見が集まっています。特に、れいわ新選組が共産党を上回る可能性や、予想以上の議席獲得に対する驚きの声が多く、また、支持者の間では議席数の増加を期待する声が強調されています。一方で、政策に対する疑問や出口調査の信憑性に対する懸念も見られます。,122,1_5
2,2_50,立憲民主党の支持拡大に対する多様な反応と疑問,このクラスタは、立憲民主党の支持が増加している状況に対する様々な意見を集めています。支持の増加に対する驚きや疑問、不安の声が多く見られ、特に外交や経済政策に対する懸念が強調されています。また、他党との比較や、支持拡大の理由に対する疑問、情報不足に対する不信感も含まれています。これらの意見は、立憲民主党の現状と将来に対する多様な視点を反映しています。,214,1_8
2,2_24,選挙結果に対する不信感と政治家への批判的意見,このクラスタは、選挙結果に対する不信感や、特定の政治家の当選に対する批判的な意見が中心です。特に、麻生太郎氏や萩生田氏の当選に対する驚きや不満、またはそれに対する批判的な意見が多く見られます。また、選挙結果が前回のものか虚偽の可能性があるという疑念も含まれています。これらの意見は、選挙制度や政治家に対する不信感を反映しており、政治の変革を求める声が背景にあることが示唆されています。,85,1_11
2,2_12,衆議院選挙における候補者の当選と支持者の反応,このクラスタは、衆議院選挙における複数の候補者の当選に関する報道や、それに対する支持者の反応を中心に構成されています。具体的には、河村さん、塩崎彰久氏、近藤和也氏、松原仁さん、あおやぎ仁士さん、塩川鉄也さん、ドリル優子、岡本あき子さん、池田真紀さん、小野寺五典氏、奥下さん、日野さん、ほろあーの先生、蓮見孝之氏、藤原たかし氏、有田さん、吉田晴美氏、丹野さんといった候補者の当選や当選確実の報道に対する喜びや驚き、期待、不満の声が含まれています。これらの意見は、選挙結果に対する有権者の多様な感情や反応を反映しています。,123,1_10
2,2_8,立憲民主党への投票に対する多様な視点と選択の背景,このクラスタは、立憲民主党への投票に関する多様な意見を集めています。主な論点として、自民党への不満から消極的に立憲民主党を選ぶケース、選挙区の選択肢の限られた状況、立憲民主党の政策に対する疑問や懸念、そして他の野党との比較が挙げられます。また、立憲民主党の躍進が増税に対する国民の覚悟を示しているという意見や、反原発の立場からの支持も見られます。これらの意見は、選挙における有権者の複雑な選択の背景を反映しています。,112,1_8
2,2_46,選挙区ごとの接戦と当選確定に対する関心と驚き,このクラスタは、特定の選挙区における接戦状況や当選確定の遅れに対する関心、驚き、期待が中心となっています。特に埼玉14区では国民民主党の優勢や公明党の苦戦が注目されており、他の選挙区でも接戦や当選確定の遅れに対する意見が多く見られます。これらの意見は、選挙結果が地域ごとに異なる政治的動向を示していることを反映しています。,102,1_9
2,2_26,公明党の選挙における影響力低下とその政治的影響,このクラスタは、公明党の代表が選挙で苦戦し、落選する可能性があることに対する驚きや、創価学会の影響力低下、人望の問題が指摘されている点に焦点を当てています。また、公明党と自民党の連携が選挙結果に与える影響や、与党が過半数を割る可能性が示唆される中での公明党の役割についての意見が含まれています。さらに、出口調査の結果に基づく議席予測や、他党の躍進に対する反応も取り上げられています。,75,1_3
2,2_65,選挙に対する多様な不安と不満の声,このクラスタは、選挙に関連する様々な不安や不満の声を集めたものです。選挙結果や投票率、システム障害、選挙違反の疑惑、選挙カーの騒音、選挙に対する失望感、政治家への不信感など、多岐にわたる選挙関連の問題が取り上げられています。また、選挙制度や投票の判断材料の不足、選挙速報に対する不安、選挙結果の変化の少なさ、選挙に対する関心の高まりなど、選挙に対する国民の多様な意見が反映されています。,194,1_13
2,2_31,丸川珠代氏の落選に対する多様な反応とその影響,このクラスタは、丸川珠代氏の選挙での落選に関する多様な意見や反応を中心に構成されています。丸川氏の落選に対する驚きや喜び、納得の声が上がる一方で、立憲民主党の当選や自民党の影響力の低下を感じる意見も見られます。また、丸川氏の落選が確実視される中で、彼女の政治的キャリアの終焉や、夫婦での落選の可能性に対する懸念も含まれています。これらの意見は、選挙結果がもたらす政治的変化や社会的影響についての関心を反映しています。,78,1_11
2,2_49,自公連立政権の過半数割れとその影響に関する多様な見解,このクラスタは、自公連立政権が過半数を割る可能性に関する多様な意見を集めています。自公が過半数を維持するかどうか、またその結果としての政局の変化に対する期待や懸念が中心です。特に、立憲民主党や他の野党の躍進、維新や国民民主党との連立の可能性、そしてそれに伴う政治的な不安や期待が議論されています。また、選挙結果が経済に与える影響や、報道機関による予測の違いについても言及されています。,116,1_3
2,2_30,河村たかし氏の選挙における支持と反応,このクラスタは、愛知1区から出馬した河村たかし氏に関する選挙結果やその影響についての意見が集まっています。河村氏の当選に対する驚きや称賛、支持の声が多く見られる一方で、彼の当選に対する懸念や落胆の声も含まれています。また、彼の政治姿勢や日本保守党との関係、名古屋での知名度が選挙結果に影響を与えていることが示唆されています。,193,1_10
2,2_38,選挙結果に対する多様な反応と分析,このクラスタは、選挙結果に対する多様な反応や分析を含んでいます。具体的には、特定の候補者の当選や落選に対する驚きや喜びの声、選挙区ごとの激戦状況、政党間の競争、候補者の個人的な背景や政策に対する評価、選挙結果を野球に例えるユニークな意見などが含まれています。また、選挙結果が地域の政治情勢や過去の事件に影響されているという分析も見られます。これらの意見は、選挙結果が人々に与える影響の多様性を示しています。,119,1_9
2,2_14,衆院選における政権交代への期待と不安,このクラスタは、衆院選を通じて政権交代の可能性に対する期待や関心が高まっている一方で、実際の政権運営やその後の政治的安定に対する不安や懸念が示されている点に焦点を当てています。特に、政権交代がもたらす変化への期待と、過去の政権交代の経験からくる不安が交錯していることが特徴です。また、特定の政党や候補者に対する地域的な不満や期待も含まれ、選挙結果が政治家に与える影響や、国政における政策推進の難しさについての意見も見られます。,189,1_6
2,2_69,選挙特番の多様な視聴体験と個人の関心,このクラスタは、選挙特番に対する視聴者の多様な関心や視聴体験に焦点を当てています。選挙特番を楽しむ人々の様子や、選挙特番を視聴することに対する個々の意見が集まっています。具体的には、選挙特番を楽しみにしている人、選挙特番を視聴することで政治に対する理解が深まったと感じる人、選挙特番を他の活動と組み合わせて楽しむ人、選挙特番を視聴することに対する個人的な変化を感じる人などが含まれています。また、選挙特番を視聴することが日常生活や他の娯楽活動にどのように影響を与えるかについての意見も見られます。,153,1_12
2,2_66,西村康稔氏の当選に対する多様な反応と背景,このクラスタは、西村康稔氏の当選に関する様々な意見を集めたものです。意見は彼の当選を喜ぶ声や驚く声、または疑問を抱く声など多岐にわたります。新党の裏金疑惑や彼の支部長辞任といった背景が影響している可能性があり、地元での支持や政治的背景に対する評価も含まれています。また、選挙結果の発表に関する不透明さや、他の政治家との比較も議論の対象となっています。,56,1_11
2,2_54,衆議院選挙における高市早苗氏と小泉進次郎氏の当選に関する意見,このクラスタは、衆議院選挙における高市早苗氏と小泉進次郎氏の当選に関する意見が中心です。高市早苗氏の当選が確実視されていることに対する支持者の喜びや驚き、彼女の夫の落選に関する意見、そして彼女が女性初の首相になることへの期待が含まれています。また、小泉進次郎氏の選挙対策委員長としての役割や当選に対する驚き、彼の発言に対する評価、選挙区の競争状況に関する意見も見られます。これらの意見は、選挙結果の確定前の状況を反映しており、選挙戦の動向や候補者に対する評価が多様に示されています。,70,1_10
2,2_67,選挙結果に対する多様な反応と自民党の影響力,このクラスタは、選挙特番を通じて報じられた自民党を中心とした選挙結果に対する国民の多様な反応を示しています。自民党の一部議員の落選や当選に対する驚きや称賛、また自民党の影響力の強さや弱さに対する意見が交錯しています。特に、自民党の当選が確実視される地域と、苦戦する地域の対比が見られ、地域ごとの政治的傾向や支持基盤の違いが浮き彫りになっています。また、他党の候補者の当選や落選に対する驚きや不満の声も含まれ、選挙結果に対する国民の期待や不安が反映されています。,131,1_7
2,2_62,日本の政党連立再編と新たな政治勢力の台頭,このクラスタは、日本の政治における連立再編の可能性と、それに伴う新たな政治勢力の台頭に関する意見が集まっています。特に、自民党と公明党の連立が過半数を割る可能性がある中で、日本維新の会や国民民主党の影響力が増すことに注目が集まっています。これにより、維新や国民民主党が与党入りすることで公明党の影響力が弱まる可能性や、連立の組み合わせによっては政権交代が起こる可能性が議論されています。また、インターネットを活用した選挙戦略や、各政党の政策スタンスの類似性についても意見が交わされています。,145,1_3
2,2_4,石破氏のリーダーシップと選挙結果に対する批判と期待,このクラスタは、石破氏のリーダーシップや選挙活動に対する批判的な意見と、彼が自民党総裁として選ばれたことに対する期待や懸念が交錯している点に焦点を当てています。特に、石破氏が総裁選で勝利したことが衆議院選挙の結果にどのように影響を与えたか、また彼の不人気が投票率や選挙結果にどのように反映されたかについての議論が中心です。また、石破氏の選出が国政の停滞を招いたとの批判や、彼の辞任の可能性についての意見も含まれています。さらに、石破氏の政治的影響力の低下や、他の政治家との比較における評価も見られます。,116,1_1
2,2_1,自民党の選挙戦略と結果に対する多様な視点と反応,このクラスタは、自民党の選挙における戦略や結果に対する多様な意見や反応を集めたものです。自民党の将来に対する不安や疑問、メディアの影響による支持率の変動、新陳代謝の必要性、特定議員の落選予測、選挙戦での苦戦や善戦、選挙対策委員長への反応、地域ごとの支持動向、与党としての責任追及、そして選挙結果に対する驚きや不満など、幅広い視点が含まれています。これらの意見は、自民党の現状と将来に対する国民の関心と期待、そして懸念を反映しています。,185,1_7
2,2_56,自民党と立憲民主党に対する不満と支持の複雑な相関,このクラスタは、自民党に対する不満がある一方で、立憲民主党がその受け皿として十分でないと感じる意見が多く含まれています。自民党の政策や問題に対する批判がある中で、立憲民主党が支持を集める理由が理解できない、あるいは不十分であるとする声が目立ちます。また、立憲民主党の政策や顔ぶれに対する疑問、民主党政権時代の経験からの不信感が根強く残っていることが示されています。さらに、選挙における選択肢の限られた状況や、野党全体の不振が国民の選挙離れにつながっているとの指摘も見られます。,165,1_8
2,2_32,選挙制度と報道に対する不信感と改善要求,このクラスタは、選挙制度や報道の在り方に対する不信感や疑問、改善要求が中心となっています。具体的には、開票が始まる前や直後に当選確実が報道されることへの疑念、出口調査の信頼性に対する不安、比例代表制の在り方に対する批判、選択肢の少なさに対する不満、そして選挙結果が日本の将来に与える影響への懸念が含まれています。これらの意見は、選挙の透明性や公正性、報道の正確性を求める声として集約されています。,109,1_13
