level,id,label,description,value,parent
2,2_18,立憲民主党の選挙における躍進とその評価,このクラスタは、立憲民主党の選挙における躍進や支持の伸びに関する意見を中心に構成されています。立憲民主党が予想以上に支持を集めていることや、選挙区での強さが評価される一方で、支持の伸びに対する驚きや懸念の声も含まれています。また、他党との比較や、選挙戦略の影響、党内外の動きが立憲民主党の成果に寄与しているとの意見も見られます。,185,1_8
2,2_36,立憲民主党と社民党の議席動向に対する多様な反応と期待,このクラスタは、立憲民主党と社民党の議席動向に関する多様な意見や感情を反映しています。立憲民主党が議席を大幅に増やす可能性についての驚きや懸念、期待が多く見られ、特に立憲民主党の議席増加が与党の過半数割れに影響を与える可能性についての意見が多いです。また、社民党が議席を確保したことに対する驚きと喜びの声も含まれています。これらの意見は、野党の議席増加が今後の政策決定に与える影響や、二大政党制の可能性についての関心を示しています。,83,1_4
2,2_59,選挙結果に対する反応と情報の信憑性に関する議論,このクラスタは、衆院選における特定の候補者の落選や当選に関する意見や反応を中心に構成されています。特に、下村博文氏や丸川珠代氏の落選に対する喜びや驚きの声が多く見られます。また、選挙結果の信憑性や情報の正確性に対する懸念も含まれており、選挙結果が確定していない中での情報の取り扱いに対する注意が示されています。さらに、比例復活の可能性や与党の議席数に関する意見も含まれ、選挙結果が政治全体に与える影響についての関心が伺えます。,191,1_11
2,2_68,石破氏を巡る自民党内外の評価と政権運営の不安,このクラスタは、来年の参院選に関連して石破茂氏に対する評価や懸念が中心となっています。石破氏が自民党の選択として批判される一方で、彼に対する同情や支持も見られます。自民党が過半数を割る可能性や、石破氏の総理としての進退、連立政権の組み替えの可能性が議論されており、石破氏のリーダーシップと自民党の選挙戦略に対する不安が示されています。また、石破氏の国際舞台での対応や、彼に責任を押し付ける動きに対する批判も含まれています。,111,1_1
2,2_34,日本維新の会の地域別支持動向と選挙結果に対する多様な意見,このクラスタは、日本維新の会の支持動向や選挙結果に関する意見を中心に構成されています。特に、大阪での強い支持と兵庫での苦戦、他地域での支持状況の違いが注目されています。また、維新の勢力が強いことに対する驚きや不満、支持の理由に対する疑問、選挙活動の裏方の重要性など、多様な視点からの意見が含まれています。これにより、維新の会が地域ごとに異なる評価を受けていることが浮き彫りになっています。,110,1_6
2,2_33,与党の過半数維持の不透明性とその影響に関する議論,このクラスタは、与党が過半数を維持できるかどうかの不透明性に関する意見が中心です。与党が過半数を割る可能性が高いとされる中で、その影響として日本の政治変革の兆しや、野党の台頭、経済への影響、国会での議論の質の向上への期待が語られています。また、選挙結果の不確実性や報道の違い、解散のタイミングに対する疑問など、選挙に関連する多様な視点が含まれています。,157,1_2
2,2_64,衆院選における与党の過半数維持の不確実性とメディア間の予測差異,このクラスタは、NHKをはじめとする各メディアが報じる衆議院選挙における与党の議席予測に関する意見を集めています。特に、与党が過半数を維持できるかどうかが微妙であるという不確実性が強調されており、NHKの予測が幅広い範囲を示していることや、他のメディア（TBS、日テレ、フジ、テレ朝、テレ東）との予測の違いが指摘されています。また、投票率の影響や無党派層の動向が与党に有利に働く可能性についての意見も含まれています。これらの意見は、選挙結果に対する期待や不安、メディアの報道に対する信頼性の問題を反映しています。,66,1_3
2,2_47,選挙速報と日本シリーズの同時放送に対する視聴者の多様な反応,このクラスタは、日本シリーズと衆院選の選挙速報が同時に放送される状況に対する視聴者の多様な反応を集めています。視聴者は、選挙速報の表示方法や放送局の選択に関する不満や評価を示しており、特にNHKの選挙報道に対する意見が多く見られます。また、選挙速報に手話や字幕を付けるべきかという議論や、特定のキャスターやナレーションに対する評価も含まれています。これらの意見は、選挙報道のあり方や視聴者の情報取得の多様性に関する関心を反映しています。,88,1_12
2,2_43,衆院選における野党の躍進と与野党の拮抗に対する多様な視点,このクラスタは、衆院選における野党の躍進や与野党の拮抗状況に対する多様な意見を集めています。野党の健闘や優勢に対する期待や驚き、与党との接戦が健全であるとする意見、野党が政権を握ることへの懸念、マスコミの予測に対する疑問、そして与野党の議席数に基づく今後の政治的動向への注目など、選挙結果に対する国民の関心が多角的に表現されています。,107,1_2
2,2_15,参政党の議席獲得に対する多様な反応と懸念,このクラスタは、参政党の議席獲得に関する多様な意見を含んでいます。参政党の躍進に対する驚きや称賛、さらなる議席獲得への期待がある一方で、反ワクチン活動や不正選挙の懸念、議席獲得に対する不安や疑問が示されています。また、メディアによる異なる報道や、参政党の政策に対する批判的な意見も含まれています。これらの意見は、参政党の成長とその影響に対する社会の多様な視点を反映しています。,27,1_4
2,2_37,選挙における世代間ギャップと若者の投票参加促進,このクラスタは、選挙における世代間の投票行動や意識の違いに焦点を当てています。特に、若者の投票率の低さや高齢者の投票行動に対する懸念が示されており、若者の政治参加を促進するための方策や、選挙制度の見直しを求める意見が多く含まれています。具体的には、選挙権や立候補年齢の制限、若者向けの候補者の必要性、選挙のエンターテインメント性の向上などが議論されています。,110,1_13
