level,id,label,description,value,parent
2,2_27,日本の政党間連携と政局の変動に関する多様な見解,このクラスタは、日本の主要政党である立憲民主党、国民民主党、日本維新の会、自民党、公明党、共産党などの間での連携や対立、そしてそれに伴う政局の変動に関する多様な意見を含んでいます。特に、維新と国民民主党の動向が今後の政治において重要な役割を果たす可能性があるとされ、これらの政党がどのように連携するか、または対立するかが注目されています。また、政権交代の可能性や、各党の支持率の変動、連立の可能性についての意見も多く見られ、これらが日本の政治の未来にどのように影響を与えるかが議論されています。,162,1_3
2,2_18,立憲民主党の躍進とその背景に対する多様な視点,このクラスタは、立憲民主党が予想以上に支持を伸ばしていることに対する驚きや評価、そしてその背景にある要因についての多様な意見が集まっています。自民党に対する不満や失策が立憲民主党の躍進に寄与しているという見解や、選挙区調整の不十分さにもかかわらずの健闘を評価する声がある一方で、躍進の理由が理解できないという意見も見られます。また、メディアの報道姿勢や二大政党制への期待、さらには個別の政策や人物に対する評価も含まれています。,185,1_8
2,2_36,立憲民主党と他政党の議席数に関する多様な意見と予測,このクラスタは、立憲民主党を中心に、他の政党の議席数に関する様々な意見や予測が集まっています。立憲民主党の議席数に関しては、増加の可能性や予測に対する驚き、疑問、期待が交錯しており、具体的な議席数の予測が幅広く示されています。また、社民党や共産党の議席数に対する注目や評価、他の政党との比較も含まれています。さらに、過去の政権経験やスキャンダルの影響に対する懸念も見られ、全体として政党の議席数が日本の政治に与える影響についての多様な視点が反映されています。,83,1_4
2,2_59,政治家の落選に対する多様な反応とその影響,このクラスタは、特定の政治家（下村博文氏、丸川珠代氏、甘利明氏など）の落選に対する様々な意見や反応を中心に構成されています。意見には、落選を喜ぶ声、驚きの声、そしてその影響についての考察が含まれています。また、落選情報の信憑性に対する疑問や、他の政治家の当選・落選に対する意見も見られます。これらの意見は、選挙結果が政治的勢力図に与える影響や、個々の政治家に対する評価を反映しています。,191,1_11
2,2_68,自民党の過半数割れと石破氏のリーダーシップに対する評価と懸念,このクラスタは、自民党が過半数を割る可能性が高まる中で、石破氏のリーダーシップに対する評価や懸念が交錯している状況を反映しています。石破氏が自民党の議席減少の責任を問われる一方で、彼の対応や今後の動きに注目が集まっています。また、石破氏の辞任や他党との連携の可能性、党内の動きに対する意見が多く見られ、石破政権の将来に対する不安や期待が入り混じっています。,111,1_1
2,2_34,大阪における維新の党の強い支持とその影響,このクラスタは、大阪を中心に維新の党が強い支持を得ている現状とその影響についての意見が集まっています。維新の党が大阪で多くの選挙区で優勢であることや、他党に対する勝利が評価される一方で、維新の勢力拡大に対する驚きや懸念、他地域での苦戦の可能性、与党接近による支持減少など、維新の党の活動に対する多様な視点が含まれています。また、維新の党が大阪で支持される理由や、選挙活動の裏方の重要性についての指摘も見られます。,110,1_6
2,2_33,与党の過半数割れに関する不安と期待の交錯,このクラスタは、与党が過半数を割る可能性に関する様々な意見が集まっています。与党が過半数を割ることで、他の野党との協力が必要になることや、政権運営の不透明感が増すことへの不安が表明されています。一方で、与党が過半数を割ることによって国民生活が楽になることを期待する声や、与党の変化に対する関心が高まっていることも示されています。また、選挙結果が経済に与える影響についての懸念も含まれています。,157,1_2
2,2_64,選挙結果予測におけるNHKと他メディアの見解の相違と不確実性,このクラスタは、NHKの選挙結果予測に対する意見や疑問、そして他のメディアとの見解の違いに焦点を当てています。特に、立憲民主党の議席数予測や自公連立の過半数維持の可能性について、NHKの報道が他のメディアと異なる点が指摘されています。また、選挙結果の不確実性や、各メディアの予測の幅広さに対する意見が集まっています。これにより、選挙結果の予測に対する信頼性や、報道の多様性が議論の中心となっています。,66,1_3
2,2_47,選挙報道とエンターテインメントの同時進行における視聴者の反応とメディアの役割,このクラスタは、選挙速報と日本シリーズの同時中継に対する視聴者の困惑や不満、選挙報道の重要性とメディアの役割に対する意見が集まっています。特に、NHKやテレビ東京などのメディアがどのように選挙速報を扱うかに注目が集まっており、視聴者は情報の信頼性や報道の方法に対して様々な反応を示しています。また、選挙の重要性を伝える番組の提案や、選挙報道における手話や字幕の必要性についての意見も含まれています。,88,1_12
2,2_43,野党の連立可能性と政権交代への期待と懸念,このクラスタは、衆院選における野党の健闘と連立の可能性に関する意見が中心です。野党が過半数を獲得する可能性や連立を組むことで政権を獲得するシナリオが注目されていますが、一方で連立の実現性やその後の協力体制に対する懸念も示されています。また、野党が政権を握った場合の政策や経済への影響についての不安も含まれています。与党の苦戦やリーダーシップへの疑問も背景にあり、政治情勢の変動が予想される中での意見が集まっています。,107,1_2
2,2_15,参政党の議席獲得に対する多様な反応と懸念,このクラスタは、参政党の議席獲得に関する様々な意見や反応を含んでいます。特に、議席数の予測や実際の獲得数に対する驚きや称賛、さらなる議席獲得への期待、不安や懸念が交錯しています。反ワクチンや反安全保障といった参政党の政策に対する懸念も多く見られ、メディアによる異なる報道や不正選挙の可能性に対する疑念も含まれています。これらの意見は、参政党の政治的立場や活動に対する社会の多様な視点を反映しています。,27,1_4
2,2_37,若者の投票率向上と高齢者の影響力に関する議論,このクラスタは、若者の投票率の低さとその影響についての懸念、高齢者の投票行動が選挙結果に与える影響、そして選挙における年齢層の違いに関する意見が集まっています。若者の投票率を上げるための具体的な対策の必要性や、選挙権に年齢制限を設けるべきだという意見、また高齢者の組織票や情報源の違いが選挙結果に与える影響についての不満が示されています。さらに、若者が選挙に参加しないことが政治的な状況を悪化させる可能性や、若者の政治参加を促進するためのインセンティブの提案も含まれています。,110,1_13
