level,id,label,description,value,parent
2,2_36,選挙結果に対する驚きと期待,このクラスタには、衆院選における社民党や立憲民主党、国民民主党の議席獲得に関する驚きや期待の声が集まっています。特に、社民党が1議席を獲得したことや、立憲民主党が大幅に議席を増やす可能性についての意見が多く見られます。これらの意見は、選挙結果が予想外であったことや、今後の政治情勢に対する不安や期待を反映しています。また、立憲民主党の議席増加に対する評価や、資金管理の重要性についての指摘も含まれています。,83,1_4
2,2_59,選挙結果に対する多様な反応と憶測,このクラスタには、衆院選における特定の政治家の落選や当選に関する意見や反応が集まっています。特に、下村博文氏や丸川珠代氏、甘利明氏などの著名な政治家の落選に対する驚きや喜び、残念に思う声が多く見られます。また、選挙結果に対する憶測や、特定の候補者の当選を喜ぶ声も含まれています。これらの意見は、選挙結果がもたらす政治的変化や地域社会への影響に対する市民の関心を反映しています。,191,1_11
2,2_68,自民党の選挙結果と石破氏の進退に関する議論,このクラスタには、自民党の選挙結果に関連して石破氏の進退や責任についての多様な意見が集まっています。議席数の減少や過半数割れの可能性が指摘される中で、石破氏に責任を負わせるべきかどうか、また彼の辞任や続投についての賛否が議論されています。さらに、石破氏の選出が選挙結果に与えた影響や、他の党との連携、政権交代の可能性についても意見が交わされています。これらの意見は、党内外の政治的動向やリーダーシップに対する期待と不安を反映しています。,111,1_1
2,2_34,維新の会の勢力拡大とその影響に対する多様な意見,このクラスタには、日本維新の会の勢力拡大に関する様々な意見が集まっています。大阪を中心に維新の会が強い支持を得ていることに対する驚きや懸念、またその影響力の拡大に対する危機感が示されています。一方で、維新の会の政策や選挙活動に対する評価や批判も見られ、特に大阪での選挙結果に対する市民の反応が多様であることがわかります。維新の会の勢力が増す中で、地域ごとの支持状況や選挙戦略の違いが浮き彫りになっており、これが今後の政治情勢にどのように影響を与えるかが注目されています。,110,1_6
2,2_33,与党の過半数維持に関する不透明な状況とその影響,このクラスタには、与党が過半数を維持できるかどうかに関する不透明な状況と、それに対する様々な意見や感情が集まっています。選挙結果が与党の過半数割れを示唆する中で、驚きや期待、不安が交錯し、連立政権の構成や国政の停滞、株式市場への影響など、政治的・経済的な影響についての懸念が示されています。また、特定の政党の支持の伸びや、過半数を微妙に超えることの理想といった意見も見られ、選挙結果が日本の政治に与える影響についての関心が高まっています。,157,1_2
2,2_64,選挙結果の不確実性とメディアの予測,このクラスタには、NHKをはじめとする各メディアが報じる衆院選の予測に関する意見が集まっています。特に、与党である自民党と公明党の連立が過半数を獲得するかどうかが微妙であるという点に焦点が当てられています。NHKの予測は幅広く、他のメディアと比較して慎重な姿勢を見せており、選挙結果の不確実性が強調されています。また、立憲民主党が議席を増やす可能性や、無党派層の投票行動が選挙結果に与える影響についても言及されています。これらの意見は、選挙結果が予測しにくい状況であることを示しており、メディアの報道が選挙の行方に対する関心を高めていることを反映しています。,66,1_3
2,2_47,選挙速報とメディアの多様な視聴体験,このクラスタには、選挙速報に関する視聴者の多様な意見や体験が集まっています。NHKをはじめとする各テレビ局の選挙報道に対する評価や批判、特定のナレーターや演出に対する注目、さらには日本シリーズとの同時中継による視聴の忙しさなど、選挙速報をどのように視聴するかに関する多様な視点が見られます。視聴者は、情報の正確性や演出、個々の好みに応じてメディアを選択し、選挙の動向を追っています。,88,1_12
2,2_43,野党の動向と政権交代への期待と懸念,このクラスタには、野党の動向や政権交代に関する様々な意見が集まっています。野党が選挙で健闘し、与党が苦戦している状況に対する期待や、野党が政権を取った場合の不安が示されています。また、野党が候補者を一本化することや、連立の可能性についての議論も含まれています。これらの意見は、政治のバランスや選挙戦略、政策の実行力に対する国民の関心を反映しています。,107,1_2
2,2_15,参政党の議席獲得に対する多様な反応と期待,このクラスタには、参政党の議席獲得に関する様々な意見が集まっています。参政党が議席を獲得したことに対する驚きや期待、または不安や懸念が表明されています。特に、反ワクチンや反安全保障といった政策に対する賛否が議論の中心となっており、参政党の議席数が増えることに対する期待と不安が交錯しています。また、メディアの報道や予測に対する意見も含まれており、参政党の今後の動向に注目が集まっています。,27,1_4
2,2_37,若者の投票率向上と世代間格差への対応,このクラスタには、若者の投票率の低さとそれに関連する問題に対する意見が集まっています。若者が選挙に行かない理由として、選挙によって生活が良くなったと感じる経験が少ないことや、選挙番組で高齢者が目立つことが挙げられています。また、若者の投票率を上げるために、人気の声優を起用したり、大学の単位やポイントなどの特典をつけることが効果的ではないかという提案があります。さらに、世代間格差を是正するために、票の価値を世代ごとに変えるべきだという意見や、若い候補者を立てるべきだという意見も見られます。これらの意見は、若者の政治参加を促進し、世代間の不均衡を是正するための具体的な方策を模索する姿勢を示しています。,110,1_13
