level,id,label,description,value,parent
2,2_41,選挙に対する多様な意見と体験,このクラスタには、選挙に関するさまざまな意見や体験が集まっています。選挙の頻度や投票率、投票所の運営時間に関する意見、選挙に参加することの意義や個人的な動機、選挙結果に対する期待や不満など、多様な視点が含まれています。また、選挙に関連する個人的な体験や感想も共有されており、選挙が日常生活に与える影響や、選挙に参加することの重要性が浮き彫りになっています。これらの意見は、選挙に対する市民の関心や参加意識の多様性を示しています。,256,1_13
2,2_21,選挙結果に対する市民の多様な反応,このクラスタには、選挙結果に対する市民の様々な感情や意見が集まっています。候補者の当選や落選に対する喜びや悲しみ、驚き、不安、満足感など、選挙結果に対する個々の反応が多様に表現されています。また、選挙活動や候補者の地道な努力が評価される一方で、期待外れの結果に対する不満や、特定の候補者や政党に対する支持や不支持の声も含まれています。これらの意見は、選挙が市民にとって重要な関心事であり、個々の投票行動がそれぞれの価値観や期待に基づいていることを示しています。,124,1_15
2,2_17,自民党の過半数割れと連立政権の行方に関する懸念と期待,このクラスタには、自民党が衆議院選挙で過半数を割る可能性に関する意見が集まっています。多くの意見が、与党の過半数割れがもたらす政治的影響や、連立政権の再編成の可能性に注目しています。特に、国民民主党や他の野党との連携がどのように進むか、またそれが政権交代につながるかどうかについての関心が高まっています。また、選挙結果が株価や経済に与える影響、与党内部の責任問題、そして選挙戦略の見直しなど、幅広い視点からの意見が見られます。,198,1_3
2,2_44,選挙における政党選択とメディアの影響,このクラスタには、選挙における政党選択の理由やメディアの影響に関する意見が集まっています。特に、自民党の裏金問題や報道の偏向が選挙結果に与える影響についての議論が多く見られます。選挙区や比例代表での投票行動において、特定の政党や候補者を選ぶ理由として、過去の政権運営や現在の政治課題への対応が挙げられています。また、メディアの報道姿勢が選挙の公正さに影響を与えているとの懸念も示されています。,133,1_7
2,2_11,選挙結果に対する多様な反応と意見,このクラスタには、選挙結果に対する市民の多様な反応や意見が集まっています。特に、岸田文雄氏や河野太郎氏の当選に対する驚きや疑問、さらには他の候補者の当選に対する感謝や不満の声が見られます。これらの意見は、選挙結果が予想外であったり、期待通りであったりすることに対する市民の感情を反映しています。また、選挙区ごとの特定の候補者に対する支持や批判、選挙戦略に対する意見も含まれており、選挙結果が地域社会や政治に与える影響についての関心が示されています。,177,1_9
2,2_39,選挙結果に対する驚きと反応,このクラスタには、選挙結果に対する驚きや反応が集まっています。特定の政治家の当選確実や当選に対して、支持者や一般市民からの驚きの声や喜びの声が上がっていることが特徴です。また、政治家の年齢や過去の選挙結果との比較に基づく意見も含まれています。これらの反応は、選挙結果が予想外であったり、期待通りであったりすることに対する市民の関心を反映しています。,159,1_10
2,2_52,国民民主党への期待と評価,このクラスタには、国民民主党に対する様々な意見が集まっています。多くの意見が国民民主党の支持の伸びや健闘を称賛し、今後の活躍に期待を寄せています。一方で、選挙戦略や政策に対する批判的な意見も見られます。また、他の政党に対する評価や期待も含まれており、特に国民民主党が自民党の受け皿として支持されているという見方があることが特徴です。全体として、国民民主党の動向に対する関心が高く、支持者からの期待が強く表れています。,176,1_4
2,2_6,選挙結果に対する多様な意見と懸念,このクラスタには、衆議院選挙の結果に対する様々な意見が集まっています。特に、立憲民主党の議席増加に対する懸念や、自民党の過半数割れに対する驚き、維新の党首に対する批判などが見られます。また、与党の議席減少や野党の議席増加に対する期待や不安、共産党の議席減少に対する失望など、多様な視点からの意見が含まれています。これらの意見は、選挙結果がもたらす政治的変動や今後の政局に対する市民の関心と不安を反映しています。,109,1_8
2,2_0,選挙の重要性と投票行動への意識向上,このクラスタには、選挙に参加することの重要性を強調し、投票行動を促進する意見が集まっています。選挙を通じて社会が変わる実感を持ち、一票の重みを感じることが重要であるとされています。選挙に行かないことが政治の変化を妨げる原因であり、投票率を上げることで政治が変わる可能性があると主張されています。また、選挙に行かない人々に対する批判や、選挙についての教育の必要性、ネット投票の導入を望む声も含まれています。これらの意見は、選挙に参加することが市民の義務であり、政治への不満を述べる前に投票行動を取るべきだという考えを共有しています。,238,1_13
2,2_10,裏金問題に対する有権者の厳しい目と選挙結果への期待,このクラスタには、裏金問題に関与したとされる議員や候補者に対する有権者の厳しい視線と、それに基づく選挙結果への期待が集まっています。有権者は、裏金問題を抱える候補者の落選を望む声や、実際に落選したことへの喜びの声を上げています。また、裏金問題に関与した議員が当選することに対する批判や疑問の声も多く、選挙を通じて政治の透明性や公正さを求める姿勢が強く表れています。これらの意見は、政治に対する市民の厳しい監視と、より良い政治を求める意識の高まりを示しています。,173,1_15
2,2_22,衆院選後の政権構成と過半数割れへの関心,このクラスタには、衆議院選挙における与党の過半数割れの可能性と、それに伴う政権構成の行方に対する関心や不安が集まっています。選挙結果が与党の過半数維持に影響を与えるかどうか、また連立政権の形成や国会運営にどのような影響を及ぼすかについての議論が活発です。特に、過半数を割った場合の連立相手の選定や、少数野党の発言力の強化、国会の機能不全への懸念が示されています。,135,1_2
2,2_25,立憲民主党の議席増加に対する疑問と懸念,このクラスタには、立憲民主党が議席を増やしていることに対する疑問や懸念が集まっています。自民党の議席減少は理解されている一方で、立憲民主党の議席増加の理由が不明確であると感じる意見が多く見られます。また、立憲民主党の政権運営能力や過去の実績に対する不安、そしてメディアの取り上げ方に対する不満も含まれています。これらの意見は、立憲民主党が野党第一党としての役割を果たすことに対する期待と不安が交錯していることを示しています。,162,1_8
2,2_63,立憲民主党の議席増加に対する多様な反応,このクラスタには、立憲民主党の議席増加に対する様々な反応が集まっています。驚きや喜びの声、疑問や懸念の声が混在しており、特に反ワクチン陰謀論者の影響力や国会での生産性に対する懸念が示されています。また、与党の圧勝よりも議論が健全になる可能性を期待する意見や、他の選択肢がなかったのかという疑問も見られます。これらの意見は、立憲民主党の議席増加が日本の政治に与える影響についての多様な視点を反映しています。,165,1_4
2,2_9,れいわ新選組の議席獲得に対する多様な意見と期待,このクラスタには、れいわ新選組の議席獲得に関する様々な意見が集まっています。れいわ新選組が衆院選で勢力を拡大する可能性についての驚きや期待、またその議席数に対する懸念や疑問が表明されています。特に、れいわ新選組が他の政党を上回る可能性や、予想以上の議席を獲得することに対する期待と不安が交錯しています。また、報道機関による議席予測の違いや、出口調査の信憑性に対する関心も示されています。これらの意見は、れいわ新選組の政治的影響力の変化に対する国民の関心の高さを反映しています。,122,1_5
2,2_50,立憲民主党の支持拡大に対する疑問と懸念,このクラスタには、立憲民主党の支持が伸びていることに対する驚きや疑問、懸念を示す意見が集まっています。多くの人々が、立憲民主党の支持拡大の理由やその背景に対して理解を示せず、過去の政権運営や他党との比較を通じてその支持の正当性を疑問視しています。また、選挙結果や有権者の選択に対する不満や、今後の政治動向に対する不安も見られます。これらの意見は、立憲民主党の支持が単なる他党への不満の表れである可能性や、政治的選択肢の限界を示唆しています。,214,1_8
2,2_24,選挙結果に対する多様な反応と疑念,このクラスタには、選挙結果や候補者に対する多様な意見や反応が集まっています。特に、麻生太郎氏や萩生田氏などの著名な政治家の当選に対する驚きや批判、支持の声が目立ちます。また、選挙結果の信憑性に対する疑念や、特定の選挙区における候補者の当選確実性に対する疑問も含まれています。これらの意見は、選挙結果がもたらす政治的影響や、選挙制度に対する市民の不信感を反映しています。,85,1_11
2,2_12,選挙結果に対する喜びと期待の声,このクラスタには、選挙結果に対する市民の反応が集まっています。多くの候補者の当選に対する喜びや祝福の声が上がっており、特に当選が確実視されていた候補者に対する期待感が表れています。また、特定の候補者の当選に驚く声や、落選の可能性に対する意見も見られます。全体として、選挙結果が市民に与える影響や、政治家への期待が反映された意見が集まっています。,123,1_10
2,2_8,選挙における政党選択のジレンマと批判,このクラスタには、選挙における政党選択に関する様々な意見が集まっています。特に、自民党に対する不満や批判がある一方で、立憲民主党や他の野党に対する支持や疑問が交錯しています。選挙権の年齢上限や投票率の低さ、政策への不安など、選挙に関する多様な視点が含まれており、国民がどの政党を支持するべきか悩む様子が伺えます。また、特定の政党に対する支持が増加する背景には、他の政党への不信感や政策への懸念が影響していることが示されています。,112,1_8
2,2_46,選挙結果への注目と期待,このクラスタには、各選挙区での選挙結果や当選確定に対する注目や期待が集まっています。特に、埼玉14区や東京24区などの接戦区や注目区において、候補者の当落に関する意見や予測が多く見られます。また、選挙結果が政治勢力に与える影響や、特定の候補者の当選に対する期待や不安の声も含まれています。これらの意見は、選挙が地域や国の政治に与える影響を強く意識していることを示しています。,102,1_9
2,2_26,選挙結果に対する公明党の影響と不安,このクラスタには、選挙における公明党の議席数の減少や代表の落選の可能性に関する意見が集まっています。出口調査の結果、自民党と公明党が過半数を割る可能性が示唆されており、公明党の政治的影響力の低下が懸念されています。また、代表の落選や選挙区での全滅の可能性が話題となり、党内でのリーダーシップの変化や今後の戦略に対する不安が広がっています。これらの意見は、公明党の今後の政治的立場や影響力に対する注目と懸念を反映しています。,75,1_3
2,2_65,選挙に対する不安と疑念,このクラスタには、日本の選挙に対する不安や疑念を示す意見が集まっています。与党の厳しい情勢や選挙結果に対する不満、選挙制度や投票の公正性に対する疑念、選挙活動における問題点などが指摘されています。また、選挙結果が日本の未来に与える影響についての不安や、選挙に対する国民の関心の低さ、メディアの報道姿勢への不満も含まれています。これらの意見は、選挙が国民の意思を正確に反映しているのか、またその結果が日本の政治にどのような影響を与えるのかについての懸念を表しています。,194,1_13
2,2_31,丸川珠代氏の落選に対する多様な反応,このクラスタには、丸川珠代氏の落選に関する様々な意見が集まっています。落選を喜ぶ声や当然とする意見、驚きや不安を感じる声、さらには自民党の影響力の低下を望む意見など、多様な反応が見られます。また、彼女の落選が確実視される中で、他の政治家の当選や落選に対する意見も交じり、選挙結果に対する国民の関心の高さがうかがえます。,78,1_11
2,2_49,自公連立の過半数割れに対する多様な意見,このクラスタには、自公連立が過半数を割る可能性に関する様々な意見が集まっています。自公が過半数を維持することを期待する意見や、過半数割れを歓迎する意見、立憲民主党の躍進に対する複雑な感情、連立相手の選択に関する議論、そして政治的混乱や経済への影響を懸念する声など、多様な視点が見られます。これらの意見は、政治の変動に対する国民の関心と不安、期待を反映しています。,116,1_3
2,2_30,河村たかし氏の選挙に関する多様な意見,このクラスタには、河村たかし氏の選挙活動や当選に関する様々な意見が集まっています。彼の当選を喜ぶ声や政策への評価、名古屋からの離脱を望む声、発言に対する批判、そして彼が日本保守党から出馬していることへの驚きなど、多様な視点が含まれています。また、彼の総理を目指す姿勢に対する期待や驚き、選挙結果に関する情報の信憑性に対する疑念も見られます。これらの意見は、河村たかし氏の政治的影響力や選挙区での支持の強さ、そして彼の将来の政治的動向に対する関心を反映しています。,193,1_10
2,2_38,選挙結果に対する驚きと評価,このクラスタには、各地の選挙結果に対する驚きや評価、そしてそれに伴う感情的な反応が集まっています。特に、保守的な地域での革新派の勝利や、長年の現職議員の落選といった予想外の結果に対する驚きの声が多く見られます。また、当選者の努力や選挙戦の背景に対する評価も含まれており、選挙結果が地域や国の政治情勢に与える影響についての関心が示されています。,119,1_9
2,2_14,政権交代に対する多様な意見と関心,このクラスタには、政権交代に関する多様な意見や関心が集まっています。政権交代を望む声や、逆に望まない声、政権交代が起こる可能性についての期待や不安、そしてその影響についての懸念が含まれています。また、選挙結果や政治的な動きに対する関心が高まっており、政権交代がもたらす変化や影響についての議論が活発に行われています。これらの意見は、政治の安定性や変革に対する国民の期待と不安を反映しています。,189,1_6
2,2_69,選挙特番を通じた家族の団らんと政治参加の楽しみ,このクラスタには、選挙特番を家族で楽しむ様子や、選挙をエンターテインメントとして捉える意見が集まっています。選挙特番を視聴することで、家族間の会話が盛り上がり、政治への関心が高まる様子が伝わります。また、投票を済ませた後に選挙特番を楽しむことで、政治参加の実感を得ることができるという意見も見られます。選挙特番が、家族の団らんや個々の政治意識の向上に寄与していることが示されています。,153,1_12
2,2_66,西村康稔氏の当選に対する多様な反応,このクラスタには、西村康稔氏の当選に関する様々な意見が集まっています。彼の当選を喜ぶ声や期待する声がある一方で、驚きや不安、疑問を抱く声も見られます。また、彼の政策や過去の行動に対する評価や懸念も含まれており、支持者と批判者の両方の視点が反映されています。これらの意見は、政治家の当選がもたらす影響や、国民の多様な期待や懸念を示しています。,56,1_11
2,2_54,選挙結果に対する驚きと批判,このクラスタには、選挙結果に対する市民の驚きや批判的な意見が集まっています。特に、小泉進次郎氏や高市早苗氏、河野太郎氏の当選に関する驚きや疑問、批判が多く見られます。これらの政治家の当選が予想されていた一方で、彼らの政策や選挙活動に対する不満や疑問が示されています。また、選挙速報や報道に対する反応も含まれており、選挙結果が市民に与える影響や関心の高さが伺えます。,70,1_10
2,2_67,選挙における自民党の動向と市民の反応,このクラスタには、自民党の選挙結果に対する市民の多様な反応が集まっています。自民党の候補者が当選したことに対する驚きや不満、逆に落選したことに対する喜びや驚きが見られます。また、選挙区ごとの自民党の強さや弱さ、利権や組織票の影響、報道の偏りに対する批判など、選挙における自民党の動向に対する市民の関心が高いことが示されています。これらの意見は、選挙結果が地域や個人の政治的期待にどのように影響を与えるかを反映しています。,131,1_7
2,2_62,連立政権の再編と新たな政治連携への期待と懸念,このクラスタには、自民党と公明党の連立が過半数を割る可能性に関連する意見が集まっています。特に、維新や国民民主党との新たな連携の可能性についての期待や懸念が多く見られます。公明党の議席減少や国民民主党の躍進に対する驚き、または満足感が示されており、連立政権の再編成が議論されています。これにより、今後の政権運営における新たな政治連携の形成や、既存の連立の解消が注目されています。市民は、これらの変化が政策にどのように影響を与えるかを見守っており、政治の安定性と実効性に対する期待と不安が交錯しています。,145,1_3
2,2_4,石破氏を巡る自民党内外の評価と期待,このクラスタには、石破氏に対する自民党内外の評価や期待、そして彼の政治的立場に関する様々な意見が集まっています。石破氏の責任問題や自民党内の刷新、選挙結果に対する不満や期待、そして他の政治家との比較など、多角的な視点から石破氏の政治的影響力や将来について議論されています。これらの意見は、石破氏が自民党内でどのように評価され、今後どのような役割を果たすのかに対する関心を示しています。,116,1_1
2,2_1,自民党の選挙結果に対する多様な意見と期待,このクラスタには、自民党の選挙結果に対する様々な意見が集まっています。自民党の当選や落選に対する失望感や期待、他党との比較、選挙制度に対する評価、そして自民党の今後の動向に対する予測や懸念が含まれています。特に、自民党が苦戦している状況や、与党から下野する可能性についての意見が多く見られ、国民の政治に対する関心の高さが伺えます。また、選挙結果に対する厳しい意見や、現状維持を望む声、政権交代の可能性についての議論も含まれています。,185,1_7
2,2_56,自民党と立憲民主党に対する不信感と選択肢の限界,このクラスタには、自民党に対する不満がある一方で、立憲民主党を支持することに対する疑問や不安が集まっています。過去の民主党政権に対する不満や懸念が根強く残っており、立憲民主党が自民党の代わりとして支持を集めることに対して懐疑的な意見が多いです。また、どの政党にも信頼を置けないという意見や、選択肢の限界を感じる声も含まれています。これらの意見は、現状の政治に対する不信感と、選挙における選択肢の不足を反映しています。,165,1_8
2,2_32,選挙制度と報道に対する不信感と改善の声,このクラスタには、衆院選における投票率の低さや開票速報の信頼性に対する不信感、選挙制度の改善を求める意見が集まっています。特に、開票前に当選確実が報じられることや、出口調査に基づく報道のスピード重視に対する疑問が多く見られます。また、選挙の準備期間の短さや投票所の確保の難しさ、比例代表制の改善を求める声もあり、選挙制度全体に対する不満と改善の必要性が示されています。これらの意見は、政治家やマスコミへの不信感を高める要因となっており、国民の政治参加意識の向上と選挙制度の透明性向上が求められています。,109,1_13
2,2_27,日本の政党間連立の可能性とその影響,このクラスタには、日本の主要政党間での連立の可能性やその影響についての意見が集まっています。特に、立憲民主党、国民民主党、日本維新の会、自民党などの政党がどのように連携し、政権を形成するかに関心が寄せられています。これらの連立の可能性は、選挙後の政治情勢や各党の戦略に大きく依存しており、国民の生活や政策に直接的な影響を与える可能性があると考えられています。また、各党の躍進や影響力の変化が、今後の日本の政治における重要な要素として注目されています。,162,1_3
2,2_18,立憲民主党の躍進に対する多様な反応と期待,このクラスタには、立憲民主党の選挙での躍進に対する様々な意見が集まっています。立憲民主党の予想以上の健闘に驚く声や、躍進を期待する声がある一方で、その勝利が自民党の失策によるものだとする意見や、政権交代に対する懸念も見られます。また、野党共闘の不在が立憲民主党にとって有利に働いたという見解や、比例での当選をラッキーと捉える意見もあります。これらの意見は、立憲民主党の躍進がもたらす政治的影響に対する国民の関心と期待を反映しています。,185,1_8
