level,id,label,description,value,parent
1,1_15,選挙結果に対する市民の多様な反応と期待,このクラスタは、選挙結果に対する市民の多様な反応や期待を集約しています。市民は、候補者の当選や落選に対する驚きや喜び、不満を表明し、特に裏金問題に関与した候補者に対する厳しい視線が注がれています。また、選挙制度や選挙区の変化に対する意見も多く、選挙が市民にとって重要な関心事であることが示されています。これらの意見は、政治の透明性や公正さを求める市民の意識の高まりを反映しています。,691,0
1,1_9,地域選挙動向と市民の反応,このクラスタは、日本各地の選挙結果や政党支持の動向に対する市民の多様な反応を集約しています。特定の地域での政党の躍進や予想外の選挙結果に対する驚き、期待、失望などの感情が表れています。選挙区ごとの政治的傾向や変化に対する市民の意見が多様であり、選挙結果が地域社会や国の政治に与える影響についての関心が示されています。,708,0
1,1_14,選挙に対する多様な視点と社会的影響,このクラスタは、選挙に関連する多様な意見や関心を集約しています。市民の選挙に対する期待や不安、選挙結果への反応、報道の公平性に対する疑問、そして選挙活動の盛り上がりなど、選挙が社会に与える影響の広がりを示しています。また、選挙に関連する裏金問題やメディアの役割、個々の市民の行動や感情の変化も含まれており、選挙が市民にとって重要な関心事であることが浮き彫りになっています。,699,0
1,1_13,選挙参加意識と制度改善への期待,このクラスタは、選挙に対する市民の多様な意見や体験を集約し、選挙参加の重要性と制度改善への期待を反映しています。市民は、投票率の向上や選挙制度の透明性を求めるとともに、選挙が日常生活に自然に組み込まれることを願っています。また、若者の投票率向上や世代間格差の是正、選挙報道の信頼性向上に対する具体的な提案が示されており、選挙を通じた社会変革への期待と懸念が表明されています。,1299,0
1,1_4,選挙結果に対する多様な反応と期待,このクラスタは、最近の選挙結果に対する国民の多様な反応や期待を集約しています。特に、立憲民主党と国民民主党の議席増加に対する驚きや評価、略称問題による投票混乱への懸念が強調されています。また、日本保守党や参政党の議席獲得に対する驚きや期待、さらには選挙結果がもたらす政治的影響についての多様な意見が見られます。これらの意見は、選挙管理の透明性や公正性、そして各政党の今後の動向に対する国民の関心を反映しています。,681,0
1,1_10,選挙結果に対する多様な市民の反応と期待,このクラスタは、衆議院選挙結果に対する市民の多様な反応を集約しています。特定の政治家の当選や落選に対する驚きや喜び、批判的な意見が見られ、選挙結果が市民に与える影響や政治家への期待、不信感が反映されています。特に、河村たかし氏や河野太郎氏、小泉進次郎氏などの政治家に対する意見が多く、選挙結果に対する市民の関心の高さと多様な視点が示されています。,723,0
1,1_7,選挙における政党動向と市民の多様な反応,このクラスタは、選挙における政党の動向や市民の反応に関する多様な意見を集約しています。特に、自民党に対する批判や支持、選挙結果に対する驚きや不満、そして政権交代への期待や懸念が示されています。また、メディアの影響や選挙制度に対する評価、裏金問題などの政治的課題に対する市民の関心が反映されており、選挙結果が地域や個人の政治的期待にどのように影響を与えるかについての議論が展開されています。,603,0
1,1_12,選挙報道と視聴者の多様な視点と体験,このクラスタは、選挙報道に対する視聴者の多様な意見や体験を集約しています。視聴者は、選挙特番をエンターテインメントとして楽しむ一方で、報道の信憑性や演出に対する批判的な意見も持っています。また、選挙とスポーツの同時中継に対する意見や、選挙報道が家族の団らんや政治参加のきっかけとなる様子も見られます。これらの意見は、選挙報道が視聴者に与える影響や期待を反映し、メディアの報道姿勢や情報提供の在り方についての多様な視点を示しています。,807,0
1,1_11,選挙結果に対する多様な反応と信頼性への懸念,このクラスタは、選挙結果に関する多様な意見や反応を集約しています。特に、選挙結果の信頼性や正確性に対する疑念が強調されており、公式な結果が確定していない状況での情報の真偽を見極めることの重要性が示されています。また、特定の政治家の当選や落選に対する驚きや喜び、批判の声が多く見られ、選挙結果がもたらす政治的影響や地域社会への影響に対する市民の関心が反映されています。,692,0
1,1_3,日本の政治的再編と連立の行方に対する期待と懸念,このクラスタは、日本の主要政党間での連立の可能性やその影響についての意見を集約しています。特に、自民党と公明党の過半数維持の不透明さが強調され、連立政権の再編成や新たな政治連携の形成に対する期待と懸念が示されています。市民は、選挙結果がもたらす政治的変化や、各党の戦略が国民生活や政策に与える影響を注視しており、政治の安定性と実効性に対する期待と不安が交錯しています。,973,0
1,1_1,石破政権の評価と自民党内外の政治的動向,このクラスタは、石破氏の政権運営に対する評価や批判、そして自民党内外の政治的動向に関する意見を集約しています。石破氏のリーダーシップや政策決定に対する不満、彼の進退に関する議論、そして自民党の選挙結果に関連する責任問題が強調されています。また、石破氏の政治的影響力や将来に対する期待と不安が交錯し、政権の持続可能性や党内刷新の必要性についての意見が反映されています。,354,0
1,1_8,選挙結果に対する多様な反応と政党選択のジレンマ,このクラスタは、衆議院選挙結果に対する市民の多様な反応や、政党選択におけるジレンマを反映しています。自民党の議席減少や立憲民主党の支持拡大に対する驚きや懸念、他党の躍進に対する期待と不安が交錯しています。また、選挙における政党選択の難しさや、現行の政治体制に対する不信感が示されており、国民が抱える政治的選択肢の限界とその影響についての意見が集約されています。,1084,0
1,1_2,選挙後の政権構成と政治的均衡への関心,このクラスタは、衆議院選挙後の政権構成や与野党の勢力均衡に対する関心を集約しています。与党の過半数割れの可能性や、連立政権の形成、野党の動向に対する期待と懸念が示されています。選挙結果が国会運営や政策実行に与える影響についての議論が活発であり、政治的な安定と変革のバランスを求める声が反映されています。,399,0
1,1_5,れいわ新選組の議席獲得に対する多様な意見と期待,このクラスタには、れいわ新選組の議席獲得に関する様々な意見が集まっています。れいわ新選組が衆院選で勢力を拡大する可能性についての驚きや期待、またその議席数に対する懸念や疑問が表明されています。特に、れいわ新選組が他の政党を上回る可能性や、予想以上の議席を獲得することに対する期待と不安が交錯しています。また、報道機関による議席予測の違いや、出口調査の信憑性に対する関心も示されています。これらの意見は、れいわ新選組の政治的影響力の変化に対する国民の関心の高さを反映しています。,122,0
1,1_6,日本の政治変動と維新の影響に対する多様な視点,このクラスタは、日本の政治情勢における変動、特に政権交代の可能性と維新の会の勢力拡大に対する多様な意見を集約しています。政権交代に対する期待や不安、維新の会の支持拡大に対する驚きや懸念が表明されており、選挙結果が今後の政治に与える影響についての議論が活発です。市民は、政治の安定性や変革に対する期待と不安を抱きつつ、特に大阪での維新の会の影響力の増大が地域や国全体の政治情勢にどのように影響を与えるかに注目しています。,299,0
2,2_42,衆院選における落選候補者への注目と意見,このクラスタには、衆議院選挙における候補者の落選に関する様々な意見が集まっています。特に、落選が確実視される候補者や大物議員の落選の可能性に対する驚きや喜びの声が多く見られます。また、選挙結果において特定の候補者の落選を望む意見や、落選が確実視されることに対する驚き、比例復活に対する懸念など、選挙の結果に対する国民の関心が高まっていることが伺えます。これらの意見は、選挙における候補者の選び方や、知名度の影響、選挙制度に対する不満や期待を反映しています。,200,1_15
2,2_16,地域ごとの選挙結果と政党の勢力図,このクラスタには、各地域における選挙結果や政党の勢力に関する意見が集まっています。特に、立憲民主党や国民民主党が特定の地域で躍進している様子や、自民党が強いとされる地域での選挙結果についての意見が多く見られます。地域ごとの選挙区の状況や候補者の影響力、選挙区の区割り変更などが選挙結果に与える影響についても言及されています。これらの意見は、地域ごとの政治的な動向や有権者の選択に関する理解を深めるための情報を提供しています。,208,1_9
2,2_61,選挙に対する多様な関心と意見の集まり,このクラスタには、選挙に関連する様々な意見や関心が集まっています。選挙に対する肯定的な意見や、出口調査の信頼性に対する疑問、SNSの影響力、選挙結果への関心、選挙を楽しむ声など、多様な視点が含まれています。また、選挙に関連する社会的な動きや、メディアの役割、個人の選挙に対する行動や感情の変化も見られます。これらの意見は、選挙が社会に与える影響の広がりと、個々の市民が選挙をどのように捉えているかを示しています。,201,1_14
2,2_20,低投票率と政治への関心の低さに対する懸念と提案,このクラスタには、選挙における低投票率や政治への関心の低さに対する懸念が集まっています。多くの意見が、投票率の低さが日本の未来に悪影響を及ぼす可能性を指摘し、投票を促進するための具体的な対策を求めています。投票を義務化することや、投票しない人に対するペナルティーの導入、投票率向上のための政治家の公約などが提案されています。また、選挙に行かない人が政治に対して文句を言うべきではないという意見や、感情的な投票行動が政策よりも優先されることへの懸念も見られます。,246,1_13
2,2_5,衆院選に対する多様な関心と期待,このクラスタには、衆議院選挙に関する多様な意見や反応が集まっています。選挙の結果や予測に対する驚きや期待、選挙活動の盛り上がり、投票率の高さへの期待、そして選挙後の議員の活動への注視など、選挙に対する市民の関心が多岐にわたっていることが示されています。また、選挙の費用に対する価値の期待や、女性候補の活躍への注目など、選挙の様々な側面に対する意見が含まれています。,221,1_14
2,2_28,選挙結果に対する多様な反応と期待,このクラスタには、選挙結果やその予測に対する市民の多様な反応が集まっています。驚きや混乱、不安、期待といった感情が入り混じり、選挙の結果やその影響についての関心が高まっていることが示されています。選挙結果が予想通りであったと感じる意見や、ねじれ国会への期待、大企業や富裕層の優遇に対する不満など、選挙がもたらす社会的・政治的な変化に対する市民の期待や懸念が表れています。また、選挙に対する興味や参加意識の高まりも見られ、選挙が市民にとって重要な関心事であることが浮き彫りになっています。,190,1_14
2,2_53,民主党略称問題による投票混乱と公平性への懸念,このクラスタには、立憲民主党と国民民主党の略称が同じ『民主党』であることに起因する投票時の混乱や公平性に対する懸念が集まっています。有権者は、投票用紙に略称を書いた際にどちらの党に票がカウントされるのか不明確であることに疑問を持ち、選挙の公正さに対する不信感を抱いています。また、略称の重複が意図的であるとの批判や、公式名称を使用すべきだという意見も見られます。これらの声は、選挙管理の透明性と正確性を求める市民の姿勢を反映しています。,28,1_4
2,2_35,選挙結果に対する驚きと期待,このクラスタには、選挙結果に対する市民の様々な反応が集まっています。接戦や予想外の結果に対する驚き、希望していた結果が出たことへの安堵、選挙区の変化に対する驚きなど、選挙結果に対する市民の関心と期待が表れています。また、選挙結果の発表が早いことに対する驚きや、選挙区の注目度に対する意識も見られます。これらの意見は、選挙が市民にとって重要な関心事であり、結果に対する期待や驚きが大きいことを示しています。,194,1_15
2,2_51,選挙結果に対する多様な反応と疑問,このクラスタには、衆議院選挙における様々な候補者の当選や落選に対する市民の反応が集まっています。特に、河野太郎氏の当選に関しては、喜びや驚き、疑問、不満など多様な意見が見られます。また、他の候補者に対する驚きや期待、批判の声も含まれており、選挙結果に対する市民の関心の高さと多様な視点が反映されています。これらの意見は、選挙結果が市民に与える影響や、政治家に対する期待や不信感を示しています。,178,1_10
2,2_29,自民党政権に対する批判と政権交代への期待,このクラスタには、自民党政権に対する批判的な意見や、政権交代を望む声が集まっています。自民党の長期政権に対する不満や、選挙結果に対する疑問、投票率の低さが与党に与える影響についての意見が多く見られます。また、他の政党に政権を任せてみることや、非自民連合に対する疑問、野党の弱さに対する指摘など、政権交代の可能性やその影響についての複雑な心境が表れています。,154,1_7
2,2_13,TBSのプロ野球と選挙同時中継に対する視聴者の多様な意見,このクラスタには、TBSがプロ野球と選挙の開票を同時に中継することに対する視聴者の多様な意見が集まっています。一部の視聴者は、野球に集中したいという意見や、選挙結果は翌日の新聞で十分だと考える意見を持っています。また、選挙報道が野球中継の視聴を妨げるという不満や、選挙情報をもっと目立たせてほしいという意見もあります。一方で、野球と選挙の両方を楽しみたいという意見や、選挙報道が有益であると評価する声もあります。さらに、選挙と野球の同時放送に対する驚きや、サブチャンネルの活用を求める意見も見られます。これらの意見は、視聴者が異なる関心を持ち、TBSの放送方法に対して様々な期待や不満を抱いていることを示しています。,95,1_12
2,2_3,国民民主党の議席増加への期待と評価,このクラスタには、国民民主党の議席増加に関する期待や評価が集まっています。石丸伸二氏への批判が選挙結果に影響を与えないという意見や、国民民主党が予想以上に議席を伸ばす可能性に注目する声が多く見られます。また、国民民主党が単独で法案を提出できる状況に期待する意見や、議席増加が政策立案に与える影響を評価する声も含まれています。全体として、国民民主党の選挙結果に対する関心とその政治的影響に対する期待が表れています。,122,1_4
2,2_57,地域ごとの政党支持動向とその影響に関する意見,このクラスタには、日本各地の選挙区における政党支持の動向やその結果に対する市民の意見が集まっています。特に、自民党や立憲民主党、社民党などの政党が地域ごとにどのように支持されているか、またその結果に対する驚きや失望、期待などの感情が表れています。地域ごとの政治的傾向や変化に対する市民の反応が多様であり、選挙結果が地域の特性や住民の意識をどのように反映しているかが議論されています。,102,1_9
2,2_2,選挙結果に関する不確実性と情報の信頼性,このクラスタには、選挙結果に関する情報の信頼性や正確性に対する疑念が集まっています。多くの情報が、前回の選挙結果や虚偽の可能性があるとされており、現時点での公式な結果が確定していないことが強調されています。市民やメディアが報じる当選情報に対して、慎重な姿勢を求める声が多く、情報の真偽を見極めることの重要性が示されています。,148,1_11
2,2_48,自民党と公明党の過半数確保に対する不安と期待,このクラスタには、自民党と公明党が過半数を確保できるかどうかに関する様々な意見が集まっています。過半数を割る可能性についての驚きや懸念、またそれに伴う政治的変化への期待が示されています。選挙結果が不透明であることから、他の政党との連立や議席の動向に注目が集まっており、政治のバランスや国会での議論の活発化を期待する声もあります。,211,1_3
2,2_60,石破氏の政権運営と退陣に関する懸念と批判,このクラスタには、石破氏の政権運営に対する批判や懸念が集まっています。石破氏の退陣や短命政権の可能性、解散総選挙の意図に対する疑問、責任問題に関する意見が多く見られます。特に、石破氏の政治的決断やその影響についての不信感が強調されており、彼の人気や支持に対する疑問も含まれています。これらの意見は、石破氏のリーダーシップや政策決定に対する不満を反映しており、彼の今後の動向に対する関心とともに、政権の持続可能性に対する不安を示しています。,127,1_1
2,2_55,自民党の議席減少に対する多様な反応と期待,このクラスタには、自民党の議席減少に関する様々な意見や反応が集まっています。自民党の議席減少を他の政党にとってのチャンスと捉える意見や、民意が反映された結果として歓迎する声がある一方で、議席減少に驚きや懸念を示す意見も見られます。また、投票率の低下や無党派層の影響についての考察、他党の躍進に対する期待、自民党の政策に対する批判など、多角的な視点からの意見が含まれています。これらの意見は、選挙結果がもたらす政治的変化や今後の政局に対する市民の関心と期待を反映しています。,137,1_8
2,2_7,選挙報道における裏金問題とその影響,このクラスタには、選挙報道における裏金問題に関する意見が集まっています。特に、テレビ局の選挙速報で裏金疑惑のある議員に対して特別なマークやユーモラスな表現が使われていることが話題になっています。これに対して、報道の公平性に疑問を持つ意見や、裏金問題が強調されすぎていると感じる意見が見られます。また、裏金問題が選挙結果に与える影響や、報道の仕方が視聴者に与える印象についても様々な反応が寄せられています。,87,1_14
2,2_45,和歌山2区選挙における世耕氏の当選とその影響,このクラスタには、和歌山2区での選挙結果に関する様々な意見が集まっています。世耕氏の当選が確実視されていることに対する喜びや祝福の声がある一方で、彼の当選に疑問を持つ意見も見られます。また、二階氏の息子の落選に対する驚きや肯定的な反応も含まれています。これらの意見は、選挙結果が地域や政党に与える影響、特に自民党への復帰の可能性や地元の政治的選択に対する評価を反映しています。,134,1_11
2,2_40,選挙速報に対する多様な視点と感情,このクラスタには、選挙速報に対する様々な意見や感情が集まっています。選挙速報をエンターテインメントとして楽しむ人や、予想外の結果に驚く人、速報の信憑性に疑問を持つ人など、多様な視点が見られます。また、速報を見ながらリラックスする人や、速報を通じて選挙の知識を深めることに価値を見出す人もいます。これらの意見は、選挙速報が単なる情報提供の場を超えて、個々の視聴者に異なる影響を与えていることを示しています。,270,1_12
2,2_23,選挙報道に対する視聴者の多様な反応と意見,このクラスタには、選挙報道に対する視聴者の様々な反応や意見が集まっています。選挙特番が多く放送されることに対する不満や驚き、つまらないと感じる意見が多く見られる一方で、特定の番組や演出に対する評価や、選挙情報の提供方法に関する提案も含まれています。また、選挙報道の影響で他の番組が見られないことへの不満や、選挙情報の提供タイミングに関する意見もあります。これらの意見は、選挙報道が視聴者に与える影響や期待を反映しており、メディアの報道姿勢や情報提供の在り方についての多様な視点を示しています。,201,1_12
2,2_19,選挙参加の重要性と日常生活の融合,このクラスタには、選挙に参加することの重要性を認識しつつ、日常生活の一部として選挙を捉える意見が集まっています。選挙に行くことを予定したり、実際に参加したりすることが、家族や友人との時間、買い物や食事といった日常の活動と結びついています。また、初めての選挙参加や若者の投票行動に対する誇りや期待、選挙に行けなかったことへの後悔の声も見られます。これらの意見は、選挙が個人の生活にどのように組み込まれているかを示し、選挙参加が社会的責任であると同時に、日常の一部として自然に行われることを願う姿勢を反映しています。,146,1_13
2,2_58,保守党の議席獲得に対する多様な反応,このクラスタには、日本保守党の議席獲得に関する様々な意見が集まっています。保守党が議席を獲得したことに対する驚きや喜びの声、さらなる議席獲得の期待、そしてその可能性に対する懸念や否定的な意見が含まれています。また、他の政党との比較や、選挙結果がもたらす政治的影響についての関心も見られます。これらの意見は、保守党の政治的地位の変化や選挙結果に対する国民の多様な反応を反映しています。,80,1_4
